Film_Adi_TR,Film_Adi_Yabanci,Film_Turu,Yonetmen,Vizyon_Tarihi,Seyirci_Sayisi,Toplam_Hasilat,Yapimci,Oyuncular,IMDb,Gosterim_Hafta,Yapimci_Ulke
Belalı Tanık,The Hitman's Bodyguard,"Komedi, Aksiyon",Patrick Hughes,8/18/2017,"111,013","1,484,320","Les Weldon, John Thompson, Mark Gill","Ryan Reynolds, Samuel L. Jackson, Elodie Yung",6.9,5,ABD
Bordo Bereliler Suriye,,"Macera, Dram, Aksiyon",Erhan Baytimur,4/7/2017,"110,948","1,271,744",16 Yapım Medya,"Cenk Ertan, Sedat Mert, Arda Esen",3.5,6,Türkiye
İlk Öpücük,,Romantik-Komedi,Murat Onbul,10/20/2017,"107,615","1,251,695",Lucky Red Films,"Murat Yıldırım, Özge Gürel, Beyti Engin",4.9,3,Türkiye
Lego Batman Filmi,The Lego Batman Movie,"Animasyon, 3 Boyutlu",Chris McKay,2/10/2017,"105,976","1,488,616","Dan Lin, Roy Lee","Will Arnett, Michael Cera, Zach Galifianakis",7.3,9,ABD
Deli Dumrul,,Komedi,Burak Aksak,9/1/2017,"96,536","1,039,624",BKM Film,"Şahin Irmak, Eda Ece, Cengiz Bozkurt",5.1,7,Türkiye
Lego Ninjago Filmi,The Lego Ninjago Movie,"Animasyon, 3 Boyutlu","Charlie Bean, Paul Fisher, Bob Logan",9/29/2017,"94,618","1,300,754","Phil Lord, Chris McKay, Dan Lin","Dave Franco, Jackie Chan, Justin Theroux",6.0,7,ABD
Tamircikler: Gizli Görev,The Fixies: Top Secret,"Animasyon, Aile","Vasiko Bedoshvili, Andrey Kolpin, Ivan Pshonkin",12/1/2017,"96,300","1,099,235","Ilya Popov, Georgiy Vasilyev, Sergey Sarkisov","Dmitriy Nazarov, Larisa Brokhman, Daria Kolbaseeva",5.0,18,Rusya
Deccal 2,,Korku,Özgür Bakar,6/16/2017,"93,081","1,067,472",NTC Medya,"Volkan Cal, Toygun Ateş, Murat Prosçiler",3.6,9,Türkiye
Ayı Paddington 2,Paddington 2,"Macera, Komedi, Animasyon",Paul King,11/24/2017,"96,436","1,208,009",David Heyman,"Hugh Grant, Jim Broadbent, Brendan Gleeson",7.8,16,"Birleşik Krallık, Fransa"
Yanlış Anlama,,Komedi,Ulaş Cihan Şimşek,11/10/2017,"116,743","1,273,464",Dada Vision,"Hakan Bilgin, Şevket Çoruh, İlker Ayrık",3.4,10,Türkiye
Bekar Bekir,,Komedi,Serdar Işık,9/1/2017,"92,119","859,570","Dijital Yapım Evi, Kırmızı Beyaz Film","Burçin Bildik, Bengi Öztürk, Bektaş Erdoğan",2.2,5,Türkiye
Kocaayak ve Oğlu,The Son of Bigfoot,Animasyon,"Ben Stassen, Jeremy Degruson",9/15/2017,"89,142","1,079,915","Ben Stassen, Cal Brunker, Caroline Van Iseghem","Christopher L. Parson, Lukas Rieger, Cinda Adams",6.1,20,"Belçika, Fransa"
Salur Kazan: Zoraki Kahraman,,Komedi,Burak Aksak,6/9/2017,"87,011","974,138",BKM Film,"Burak Çimen, Mahir İpek, Devrim Yakut",5.0,5,Türkiye
Sevimli Emojiler,The Mojicons,Animasyon,Alexander Romanetz,8/11/2017,"86,835","988,185",Michelle Raimo,"Ahmet Taşar, Arda Kavaklıoğlu, Banu Altay",3.4,23,Rusya
Dört Köşe,,Komedi,Ömer Faruk Yardımcı,10/6/2017,"84,614","929,534","Mucizeler Evi Yapım, San Medya","Ayhan Taş, Murat Akkoyunlu, Beyti Engin",4.6,3,Türkiye
anne!,mother!,Dram,Darren Aronofsky,9/29/2017,"80,138","1,129,008","Darren Aronofsky, Scott Franklin,  Ari Handel","Kristen Wiig, Jennifer Lawrence, Javier Bardem",6.6,4,ABD
Yaşamak Güzel Şey,,"Komedi, Dram",Müfit Can Saçıntı,4/14/2017,"75,192","890,049","Artistik Yapım, Conka Film","Müfit Can Saçıntı, Reha Özcan, Ayşegül Atik",7.4,7,Türkiye
Küçük Vampir,The Little Vampire 3D,"Animasyon, Aile, 3 Boyutlu","Karsten Kiilerich, Richard Claus",11/17/2017,"73,235","958,616","Richard Claus, Chris Brouwer","Jim Carter, Rasmus Hardiker, Alice Krige",5.4,10,Almanya
Ölümcül Deney: Dejavu,Tell Me How I Die,Gerilim,D.J. Viola,4/28/2017,"69,409","776,296"," D.J. Viola, Andrew Alter, Jack Heston","Nathan Kress, Virginia Gardner, Kirby Bliss Blanton",5.0,4,ABD
Ayı Kardeşler: Sirkte Curcuna,Boonie Bears: The Big Top Secret,"Animasyon, 3 Boyutlu",Ding Liang,7/14/2017,"85,986","813,400","Fantawild Animation, Le Vision Pictures","Wan Danqing, Chen Guang, Ma Haolun",4.8,4,Çin
Süper Yetenek,Rock Dog,Animasyon,Ash Brannon,3/10/2017,"67,851","807,151","David B. Miller, Zheng Jun, Amber Wang"," Luke Wilson, Ziya Kürküt",5.9,18,"ABD, Çin"
Suikastçı,American Assassin,Aksiyon,Michael Cuesta,9/15/2017,"66,260","822,945","Lorenzo di Bonaventura, Nick Wechsler","Michael Keaton, Dylan O'Brien, Taylor Kitsch",6.2,5,ABD
Cesur Kahraman: Ejderha Büyüsü,The Dragon Spell,Animasyon,"Depoyan Manuk, Viktor Andrienko",1/27/2017,"68,763","679,681","Dmytro Belinkiy, Iryna Manzhosova, Igor Roma","Fatih Özkul, Ali Hekimoğlu, Işıl Kılıç",5.2,26,Ukrayna
Büyü 2,,Korku,Adnan Güler,6/23/2017,"65,990","736,558",Sea Film,"Yeşim Salkım, Gizem Salkım, Özgül Kavruk",2.0,7,Türkiye
Eski Sevgili,,Romantik-Komedi,Emir Khalilzadeh,5/5/2017,"64,260","748,017",Maya Medya,"Sadi Celil Cengiz, Tolgahan Sayışman, Ünal Yeter",3.9,3,Türkiye
Sahil Güvenlik,Baywatch,Komedi,Seth Gordon,6/2/2017,"63,752","833,139","Dwayne Johnson, Michael Berk, Douglas Schwartz","Priyanka Chopra, Kelly Rohrbach, Dwayne Johnson",5.5,5,ABD
Orman Çetesi,Les As de la Jungle,"Animasyon, 3 Boyutlu",David Alaux,7/28/2017,"73,892","727,785","Bonnie Arnold, Christian Kubsch","Arda Kavaklıoğlu, Ali Hekimoğlu, Selay Taşdöğen",5.4,45,Fransa
Ay Işığı,Moonlight,Dram,Barry Jenkins,2/17/2017,"59,888","832,652","Brad Pitt, Adele Romanski, Jeremy Kleiner","Mahershala Ali, Naomie Harris, Janelle Monáe",7.4,21,ABD
Snowden,,"Gerilim, Dram, Biyografi",Oliver Stone,1/6/2017,"56,061","809,261"," Jérôme Seydoux, James D. Stern","Nicolas Cage, Scott Eastwood, Parker Sawyers",7.3,18,"ABD, Almanya"
Özgürlüğün Sesi Bilal,Bilal: A New Breed of Hero,Animasyon,"Khurram H. Alavi, Ayman Jamal",5/26/2017,"54,234","542,518","Eymen Cemal, Arif Jilani","Adewale Akinnuoye-Agbaje, Thomas Ian Nicholas, Mark Rolston",7.6,13,Birleşik Arap Emirlikleri
Osmanlı Subayı,The Ottoman Lieutenant,"Dram, Savaş",Joseph Ruben,5/19/2017,"51,117","606,331",Stephen Joel Brown,"Josh Hartnett, Haluk Bilginer, Ben Kingsley",6.4,6,ABD
Saftirik Greg'in Günlüğü: Bende Bu Şans Varken!,Diary of a Wimpy Kid: The Long Haul,Komedi,David Bowers,5/19/2017,"50,702","657,908","Nina Jacobson,  Brad Simpson‎","Jason Drucker, Charlie Wright, Alicia Silverstone",4.3,3,ABD
The Circle,,"Gerilim, Bilim-Kurgu, Dram",James Ponsoldt,4/28/2017,"50,538","740,258","Tom Hanks, James Ponsoldt, Gary Goetzman","Tom Hanks, Emma Watson, John Boyega",5.3,8,"ABD, Birleşik Arap Emirlikleri"
Lion,,Dram,Garth Davis,2/3/2017,"49,372","793,699","Emile Sherman, Iain Canning, Angie Fielder","David Wenham, Sunny Pawar, Dev Patel",8.0,8,"ABD, Avustralya, Birleşik Krallık"
Nane ile Limon: Kayıp Zaman Yolcusu,,"Macera, Animasyon, Aile","Günay Köker, Çağrı Cem Bayraklı",5/12/2017,"47,978","537,363","Cordoba, Siyah Martı","Balım Gaye Bayrak, Seda Güven, Anıl İlter",4.1,8,Türkiye
Power Rangers,,"Bilim-Kurgu, Fantastik, Aksiyon",Dean Israelite,3/24/2017,"47,431","580,110","Haim Saban, Brian Casentini, Marty Bowen","Elizabeth Banks, Bryan Cranston, Naomi Scott",5.9,3,ABD
Macera Günlükleri: Sihirli Adaya Yolculuk,The Shonku Diaries: A Unicorn Adventure,"Animasyon, 3 Boyutlu",Kamal Bansal,11/3/2017,"55,512","570,904",Kamal Bansal,"David Lodge, John Snyder, Kira Buckland",5.5,27,Hindistan
Yaşamın Kıyısında,Manchester by the Sea,Dram,Kenneth Lonergan,2/3/2017,"46,037","658,343","Matt Damon, Kimberly Steward, Chris Moore","Michelle Williams, Casey Affleck, Kyle Chandler",7.8,20,ABD
Zombi Ekspresi,"Busanhaeng, Train to Busan","Korku, Gerilim, Aksiyon",Sang-ho Yeon,7/21/2017,"46,528","532,204",Lee Dong-ha,"Yoo Gong, Soo-an Kim, Yu-mi Jeong",7.6,21,Güney Kore
Kurbağa Krallığı: Buz Macerası,Frog Kingdom 2: Sub-Zero Mission,Animasyon,Fei Peng,12/30/2016,"44,492","468,131","Eric P. Sherman, Jinye Gao","Ziya Kürküt, Pınar Erengil, Dündar Müftüoğlu",5.8,7,Çin
Martıların Efendisi,,"Aşk, Dram",Mehmet Ada Öztekin,12/22/2017,"59,345","759,781",Erol Avcı,"Mehmet Günsür, Bige Önal, Barış Yıldız",6.0,4,Türkiye
Sinyalciler,,Komedi,Ahmet Kapucu,6/16/2017,"42,809","488,631",TFI,"Tamer Karadağlı, Cemal Hünal, Ayhan Taş",3.1,6,Türkiye
Kapan,Get Out,"Korku, Gizem",Jordan Peele,4/21/2017,"42,685","563,842","Sean McKittrick, Jason Blum, Edward H. Hamm","Catherine Keener, Daniel Kaluuya, Allison Williams",7.7,4,ABD
Mucize,Wonder,Dram,Stephen Chbosky,11/24/2017,"44,051","664,341","David Hoberman, Todd Lieberman","Owen Wilson, Julia Roberts, Jacob Tremblay",7.9,15,ABD
Şanslı Logan,Logan Lucky,"Komedi, Suç",Steven Soderbergh,8/25/2017,"40,175","520,540","Gregory Jacobs , Channing Tatum , Reid Carolin","Adam Driver, Riley Keough, Channing Tatum",7.0,4,ABD
Her Şey Mümkün,,"Macera, Romantik-Komedi",Alper Babayağmur,5/19/2017,"39,237","411,164",Netvizyon,"Umut Oğuz, Haldun Dormen, Bora Sivri",5.1,5,Türkiye
Bir Nefes Yeter,,"Aşk, Dram",Yasemin Erkul Türkmenli,10/13/2017,"38,690","453,143",Bizim Reklamcılık Yapım,"Tuvana Türkay, Zuhal Gencer Erkaya, Seçkin Özdemir",6.2,6,Türkiye
Tüylü Kaçak,Run Ozzy Run,Animasyon,"Nacho La Casa, Alberto Rodriguez",2/3/2017,"39,306","451,030","Nacho la Casa, Jeff Bell, Ken Zorniak","Michelle Jenner, Dani Rovira, Elsa Pataky",5.2,14,"İspanya, Kanada"
Ruhlar Evi,Ghost House,Korku,Rich Ragsdale,7/21/2017,"38,140","408,776","Kevin Ragsdale, Veronica Radaelli, Luke Daniels","Scout Taylor-Compton, James Landry Hébert, Mark Boone Junior",4.7,5,"ABD, Tayland"
Deha,Gifted,Dram,Marc Webb,5/26/2017,"37,971","531,835","Andy Cohen, Karen Lunder","Chris Evans, Jenny Slate, Mckenna Grace",7.6,6,ABD
2:22,,Gerilim,Paul Currie,6/30/2017,"37,470","494,092","Jodi Matterson, Paul Currie","Michiel Huisman, Teresa Palmer, Sam Reid",5.7,6,"ABD, Avustralya"
Gizli Sayılar,Hidden Figures,Dram,Theodore Melfi,2/24/2017,"37,494","575,470","Theodore Melfi, Pharrell Williams, Jenno Topping","Taraji P. Henson, Octavia Spencer, Janelle Monáe",7.8,9,ABD
Bas Gaza,Overdrive,Aksiyon,Antonio Negret,8/11/2017,"36,239","402,397","Michael Brandt, Derek Haas, Pierre Morel","Simon Abkarian, Scott Eastwood, Ana de Armas",5.3,6,"ABD, Fransa"
Felak,,Korku,Mehmet Emin Şimşek,1/13/2017,"37,766","372,907",SineLama,"Özlem Durmaz, Banu Çiçek, Yusuf Memiş",4.5,18,Türkiye
Saplantı,Unforgettable,Gerilim,Denise Di Novi,5/5/2017,"32,832","413,824","Denise Di Novi, Alison Greenspan, Ravi D. Mehta","Rosario Dawson, Katherine Heigl, Whitney Cummings",5.1,4,ABD
Açık Deniz 3: Kafes Dalışı,Open Water 3: Cage Dive,"Gerilim, Dram",Gerald Rascionato,8/18/2017,"31,958","364,438","Gerald Rascionato, Charles M. Barsamian, Rana Joy Glickman","Megan Peta Hill, Joel Hogan, Suzanne Dervish-Ali",4.2,4,Avustralya
Her Şey,"Everything, Everything","Aşk, Dram",Stella Meghie,8/11/2017,"31,818","393,911","Leslie Morgenstein , Elysa Koplovitz","Nick Robinson, Amandla Stenberg, Anika Noni Rose",6.3,3,ABD
Denizde Dehşet,47 Meters Down,"Korku, Gerilim",Johannes Roberts,8/4/2017,"31,641","410,804",Johannes Roberts,"Mandy Moore, Claire Holt, Chris Johnson",5.6,6,"ABD, Birleşik Krallık, Dominik Cumhuriyeti"
Kahramanlar Takımı,Monkey King: Hero Is Back,"Animasyon, 3 Boyutlu",Tian Xiao Peng,5/19/2017,"31,859","332,410","Weiming Wang, Hui Jiang, Yongan Xu","Jackie Chan, Feodor Chin, Nika Futterman",6.7,19,Çin
Katliam Günü,The Windmill Massacre,Korku,Nick Jongerius,6/30/2017,"31,275","332,977",Nick Jongerius,"Charlotte Beaumont, Patrick Baladi, Ben Batt",4.9,5,Hollanda
Cin Ayet-i Aşk,,Korku,Ahmet Küçükkayalı,7/28/2017,"29,937","334,925",Gitassi Ajans,"Funda Bostanlık, Emre Kıvılcım, Gülçin Tunçok",5.8,6,Türkiye
Genç Karl Marx,"Le jeune Karl Marx, The Young Karl Marx","Dram, Biyografi",Raoul Peck,5/19/2017,"29,174","369,166",Raoul Peck,"Vicky Krieps, August Diehl, Stefan Konarske",6.6,20,"Almanya, Belçika, Fransa"
Jackie,,"Dram, Biyografi",Pablo Larraín,1/20/2017,"29,957","487,905"," Darren Aronofsky, Juan de Dios Larraín","Natalie Portman, Peter Sarsgaard, Greta Gerwig",6.7,12,"ABD, Fransa, Şili"
Kanlı Oyun,Scare Campaign,Korku,"Cameron Cairnes, Colin Cairnes",5/19/2017,"28,830","326,582",Julie Ryan,"Olivia DeJonge, Meegan Warner, Ian Meadows",5.8,12,Avustralya
Dünyanın En Güzel Kokusu 2,,"Aşk, Dram",Mustafa Uğur Yağcıoğlu,11/3/2017,"32,107","400,283",25 Film,"Rıza Kocaoğlu, Tuba Ünsal, Burak Altay",5.1,4,Türkiye
Firardayız,,Komedi,Tolga Baş,9/29/2017,"28,618","310,272",Artist Film Yapım,"Çetin Altay, Mehmet Özgür, Burak Satıbol",3.1,11,Türkiye
Tavşan Okulu,"Die Häschenschule, Rabbit School","Animasyon, 3 Boyutlu",Ute von Münchow-Pohl,6/23/2017,"34,939","314,977",Dirk Beinhold,"Noah Levi, Friedrich von Thun, Senta Berger",5.6,43,Almanya
Son Macera,Going in Style,"Komedi, Suç",Zach Braff,4/21/2017,"26,776","406,936","Donald De Line, Tony Bill","Morgan Freeman, Michael Caine, Matt Dillon",6.6,9,ABD
Aşk Uykusu,,Dram,Nisan Akman,3/31/2017,"26,687","341,092",Nöbetçi Yapım,"Alican Yücesoy, Hasan Küçükçetin, Lale Başar",4.2,3,Türkiye
Sniper: Duvar,The Wall,"Gerilim, Dram, Savaş",Doug Liman,6/16/2017,"26,146","334,270",Dave Bartis,"Aaron Taylor-Johnson, John Cena, Laith Nakli",6.2,3,ABD
Lanet: Ervah Cinleri,,"Korku, Gerilim",Teoman Gündüz,4/28/2017,"25,355","282,261",Sineva Film,"Zahid Çetinkaya, Sevcan Sini, Ufuk Özkaya",4.5,5,Türkiye
Doraemon: Buz Devri Macerası,Eiga Doraemon: Nobita no nankyoku kachikochi daibouken,Animasyon,Atsushi Takahashi,8/18/2017,"30,677","300,258"," Shin-Ei Animation, Fujiko F. Fujio Pro","Yumi Kakazu, Subaru Kimura, Wasabi Mizuta",6.6,27,Japonya
Baş Belası,,Komedi,Tolga Baş,5/5/2017,"25,083","286,538",Artist Film Yapım,"Selen Seyven, Yakup Yavru, Mesut Yar",6.8,4,Türkiye
Buğday,,Dram,Semih Kaplanoğlu,11/24/2017,"33,192","304,793","Galata Film, Kaplan Film","Lubna Azabal, Jean-Marc Barr, Ermin Bravo",6.1,18,"Türkiye, Almanya, Fransa, İsveç"
Kedi,,Belgesel,Ceyda Torun,6/9/2017,"27,746","307,128",Bir Film,"Mike Myers, Dakota Fanning, Spencer Breslin",7.6,30,"Türkiye, ABD"
Şeytanın Doğuşu,FirstBorn,Korku,Nirpal Bhogal,6/2/2017,"24,507","279,253",Uzma Hasan,"Antonia Thomas, Jonathan Hyde, Lucy Chappell",4.8,4,Birleşik Krallık
11,,"Gerilim, Aksiyon",Can Varol,6/9/2017,"23,997","276,435",Carat Film,"Cansu Şahin, Ufuk Avcı, Kristina Ivanova",4.8,6,Türkiye
Zer,,Dram,Kazım Öz,4/21/2017,"27,624","300,528",Koz Film,"Füsun Demirel, Nik Xhelilaj, Güler Ökten",6.7,24,"Türkiye, Almanya"
Korku Kayıtları,The Crucifixion,"Korku, Gerilim",Xavier Gens,10/6/2017,"22,097","287,345","Chad Hayes, Carey W. Hayes, Peter Safran","Sophie Cookson, Corneliu Ulici, Brittany Ashworth",5.1,3,"Birleşik Krallık, Romanya"
Semur,,"Korku, Gerilim",Gökhan Aksu,8/18/2017,"22,694","232,161",Ayhan Ulam Yapım,"Balamir Emren, İpek Erdem, Gamze Pelin Gökçe",5.0,12,Türkiye
Kutsal Geyiğin Ölümü,The Killing of a Sacred Deer,"Korku, Dram, Gizem",Yorgos Lanthimos,11/17/2017,"27,784","365,704","Yorgos Lantimos, Ed Guiney","Colin Farrell, Nicole Kidman, Barry Keoghan",7.0,25,"Birleşik Krallık, İrlanda"
Satıcı,"Forushande, The Salesman","Gerilim, Dram",Asghar Farhadi,1/27/2017,"23,349","265,235","Asgar Ferhadi, Alexandre Mallet-Guy","Mina Sadati, Shahab Hosseini, Taraneh Alidoosti",7.7,32,"Fransa, İran"
666 Cin Musallatı,,Korku,Fuat Yılmaz,5/5/2017,"21,528","232,149","BYFY Productions, Derin Film","Ekrem İspir, Elif Yaz, Teena Tabbarah",4.3,23,Türkiye
Bu da Nereden Çıktı?,Why Him?,Komedi,John Hamburg,1/20/2017,"21,036","350,446","Jonah Hill, Ben Stiller, Shawn Levy","James Franco, Zoey Deutch, Bryan Cranston",6.2,4,ABD
Büyülü Kanatlar,Lighting Dindin,Animasyon,Wei-Feng Deng,10/13/2017,"30,193","260,153",Wang Yunfei," Youji Wang, Lei Yao, Sheng Guo",6.0,35,Çin
Şeytanın Oğlu,Incarnate,"Korku, Gerilim",Brad Peyton,12/30/2016,"20,674","216,309","Trevor Engelson, Michael Seitzman, Jason Blum","Aaron Eckhart, Mark Steger, Carice van Houten",5.3,12,ABD
Gecenin Kanunu,Live by Night,"Dram, Suç",Ben Affleck,2/3/2017,"20,536","308,500","Ben Affleck, Leonardo DiCaprio, Jennifer Todd","Ben Affleck, Sienna Miller, Chris Cooper",6.4,2,ABD
Gamba: Macera Çetesi,Gamba: Ganba to Nakamatachi,"Animasyon, 3 Boyutlu","Yoshihiro Komori, Tomohiro Kawamura",5/5/2017,"21,171","230,145","Avi Arad, Tetsu Fujimura, Muneyuki Kii","Jack Merluzzi, iJustine, Jeff Manning",5.1,11,Japonya
T2 Trainspotting,,Dram,Danny Boyle,5/5/2017,"20,258","306,126","Danny Boyle, Andrew Macdonald, Christian Colson","Shirley Henderson, Ewan McGregor, Jonny Lee Miller",7.2,5,Birleşik Krallık
Bakıcı,Inconceivable,"Gerilim, Dram",Jonathan Baker,6/30/2017,"19,936","266,979","Jonathan Baker, Randall Emmett, George Furla","Nicolas Cage, Jonathan Baker, Gina Gershon",5.2,5,Kanada
Manifesto,,Dram,Julian Rosefeldt,8/11/2017,"22,626","246,223","Julian Rosefeldt, Marcos Kantis, Martin Lehwald",Cate Blanchett,6.5,20,"Almanya, Avustralya"
Gerçeğin İki Yüzü,The Last Face,Dram,Sean Penn,5/5/2017,"18,759","266,055","Matt Palmieri, Bill Pohlad, Bill Gerber","Jean Reno, Charlize Theron, Javier Bardem",4.9,3,ABD
Mezeci Çırağı,,Dram,Battal Karslıoğlu,4/14/2017,"18,702","126,398",Majör Prodüksiyon,"Murat Ercanlı, Yusuf Atala, İsmail Arda İrman",6.4,3,Türkiye
Otopsi,The Autopsy of Jane Doe,Korku,André Øvredal,4/14/2017,"18,676","253,490","Eric Garcia, Fred Berger, Rory Aitken","Emile Hirsch, Brian Cox, Ophelia Lovibond",6.8,3,Birleşik Krallık
Kare,The Square,"Komedi, Dram",Ruben Östlund,11/3/2017,"22,352","258,668","Erik Hemmendorff, Philippe Bober","Elisabeth Moss, Dominic West, Claes Bang",7.1,28,"Almanya, Danimarka, Fransa, İsveç"
Sinsiran: Yasak Aşk,,"Korku, Gerilim",Samet Çakırtaş,5/26/2017,"17,953","192,869",Art İstanbul,"Şehmus Kartal, Pınar Güven, Bilge Bilge",3.1,4,Türkiye
Dokuzuncu Hayat,The 9th Life of Louis Drax,Gerilim,Alexandre Aja,6/9/2017,"17,772","220,523","Alexandre Aja, Max Minghella, Tim Bricknell","Jamie Dornan, Sarah Gadon, Aaron Paul",6.3,3,"ABD, Birleşik Krallık, Kanada"
Saklambaç: Ölüm Oyunu,,Gerilim,Samet Çakırtaş,7/21/2017,"17,621","214,761",Blackwell Distribution,"Beyza Geçeci, Hatice Öztürk, Yusuf Karakuyu",0.0,4,Türkiye
Max Steel,,"Macera, Bilim-Kurgu, Aksiyon",Stewart Hendler,4/21/2017,"17,362","196,091","Bill O'Dowd, Julia Pistor","Ben Winchell, Maria Bello, Andy Garcia",4.6,2,ABD
Yarını Yok,24 Hours to Live,"Gerilim, Aksiyon",Brian Smrz,12/1/2017,"17,186","227,417",Fundamental Films,"Ethan Hawke, Paul Anderson, Liam Cunningham",5.8,4,"ABD, Güney Afrika, Hong Kong"
Yaşam Kürü,A Cure for Wellness,Korku,Gore Verbinski,3/17/2017,"17,108","248,040","Gore Verbinski, David Crockett, Arnon Milchan","Dane DeHaan, Johannes Krisch, Jason Isaacs",6.4,4,ABD
Poyraz Karayel: Küresel Sermaye,,Aksiyon,Osman Taşçı,12/15/2017,"17,141","206,811",Content Turkey,"Bora Akkaş, Sadi Celil Cengiz, Reha Özcan",4.5,3,Türkiye
Kardan Adam,The Snowman,Gerilim,Tomas Alfredson,11/17/2017,"16,473","231,666","Robyn Slovo, Eric Fellner, Tim Bevan","Val Kilmer, Chloë Sevigny, Michael Fassbender",5.1,2,ABD
Mezarcı,,"Komedi, Dram",Talip Karamahmutoğlu,8/11/2017,"16,140","149,219",Kuzey Film,"Mustafa Uzunyılmaz, Orhan Aydın, Emre Altuğ",4.9,3,Türkiye
İşe Yarar Bir Şey,,Dram,Pelin Esmer,10/27/2017,"22,630","215,297","Mars Production, Sinefilm","Ayşenil Şamlıoğlu, Berfu Öngören, Başak Köklükaya",7.6,27,"Türkiye, Almanya, Fransa, Hollanda"
Miraç,,Dram,Enes Hakan Tokyay,4/21/2017,"15,605","142,271",Galibarda Fikir Sanat,"Meltem Miraloğlu, Ufuk Bayraktar, Arda Şahin",4.6,11,Türkiye
Cenaze İşleri,,Komedi,Korhan Uğur,9/8/2017,"15,578","70,826","Saygın Film, Serpil Altın Film","Melih Selçuk, Melis Cemre Çınar, Ergun Kuyucu",3.6,4,Türkıye
The Bye Bye Man,,"Korku, Gerilim",Stacy Title,7/7/2017,"14,864","170,093","Trevor Macy, Simon Horsman, Jeffrey Soros","Douglas Smith, Lucien Laviscount, Jenna Kanell",4.3,4,ABD
Spark: Bir Uzay Macerası,Spark,Animasyon,Aaron Woodley,7/7/2017,"
14.578","160,129","Hyungkon Kim, Bill Bindley,Woo-Kyung Jung","Jessica Biel, Hilary Swank, Susan Sarandon",4.4,8,"Güney Kore, Kanada"
Ben Ölmeden Önce,Before I Fall,Dram,Ry Russo-Young,3/17/2017,"14,275","220,641","Matt Kaplan, Brian Robbins
, Jonathan Shestack

","Halston Sage, Zoey Deutch, Elena Kampouris",6.9,5,ABD
Benzersiz,,"Komedi, Aksiyon, Gizem",İlker Sarı,9/15/2017,"13,969","149,956",Lal Sanat Atölyesi,"Cemal Hünal, Ekin Türkmen, Ruhi Sarı",4.4,5,Türkiye
Koca Dünya,,Dram,Reha Erdem,4/7/2017,"15,989","140,357",Atlantik Medya,"Ecem Uzun, Berke Karaer, Melisa Akman",6.8,23,Türkiye
"Ben, Daniel Blake","I, Daniel Blake","Dram, Politik",Ken Loach,12/30/2016,"14,481","154,605",Rebecca O'Brien,"Dave Johns, Hayley Squires, Sharon Percy",7.8,22,"Belçika, Birleşik Krallık, Fransa"
Mutlu Son,Happy End,Dram,Michael Haneke,10/13/2017,"16,225","181,564","Margaret Ménégoz, Stefan Arndt, Michael Katz","Isabelle Huppert, Jean-Louis Trintignant, Mathieu Kassovitz",6.6,20,"Almanya, Avusturya, Fransa"
Yeni Yıl Tehlikede,"Santa & Cie, Christmas & Co","Komedi, Aile",Alain Chabat,12/15/2017,"16,802","185,480","Ilan Goldman, Sylvain Goldberg","Audrey Tautou, Golshifteh Farahani, Alain Chabat",6.3,10,Fransa
Neruda,,"Dram, Biyografi",Pablo Larraín,3/10/2017,"14,008","176,529","Juan de Dios Larraín, Peter Danner, Renan Artukmac","Gael Garcia Bernal, Alfredo Castro, Luis Gnecco",6.8,17,"ABD, Arjantin, Fransa, İspanya, Şili"
Bilim Kurgu Bölüm 1: Son Savaşçı,Science Fiction Volume One: The Osiris Child,Bilim-Kurgu,Shane Abbess,8/11/2017,"13,302","148,752","Shane Abbess, Brian Cachia, Matthew Graham","Isabel Lucas, Rachel Griffiths, Kellan Lutz",5.5,3,Avustralya
Blue,,Belgesel,Mehmet Sertan Ünver,4/21/2017,"13,490","137,146",Güverte Film,Blue Blues Band,0.0,14,Türkiye
Otoban,Collide,"Gerilim, Aksiyon",Eran Creevy,3/24/2017,"12,952","162,231"," Robert Ogden Barnum, Lucas Jarach, Luke Daniels","Anthony Hopkins, Ben Kingsley, Nicholas Hoult",5.6,5,"ABD, Almanya, Birleşik Krallık"
Tatlı Şeyler,,Komedi,Uğur Uludağ,6/23/2017,"12,834","156,867",Mai Film,"Cem Uçan, Demet Şaşmaz, Cem Özer",3.4,3,Türkiye
Sarıkamış Çocukları,,Dram,"Can Ulkay, Mutlu Karadoğan",3/31/2017,"12,280","116,706",Dijital Yapım Evi,"Altan Erkekli, Sema Çeyrekbaşı, Burç Kümbetlioğlu",5.8,7,Türkiye
Bezm-i Ezel,,"Korku, Gerilim",Aykut Can Demirel,7/21/2017,"12,351","128,743",Arı Kovanı,"Ebru Eker, Berkan Tutu, Buğra Han Kirişoğlu",3.8,8,Türkiye
Kuyu [2017],,"Korku, Gerilim",Serdar Bardakçı,3/17/2017,"12,050","130,983",Marla Yapım,"Murat Ercanlı, Oğuzhan Yücel, Dilara Duman",2.5,6,Türkiye
Vampir Cehennemi: İstila,The Stakelander,"Korku, Aksiyon","Robert Olsen, Dan Berk",6/9/2017,"11,908","127,002","Larry Fessenden, Peter Phok, Greg Newman","Connor Paolo, Nick Damici, Steven Williams",5.3,11,ABD
Suburbicon,,"Komedi, Suç, Gizem",George Clooney,12/8/2017,"13,816","190,555","George Clooney, Grant Heslov, Teddy Schwarzman","Julianne Moore, Matt Damon, Oscar Isaac",5.8,9,"ABD, Birleşik Krallık"
Organik Aşk Hikayeleri,,"Romantik-Komedi, Dram",Alpgiray M. Uğurlu,8/11/2017,"11,258","116,222",Minus Green,"Sadi Celil Cengiz, Furkan Kızılay, Gökhan Alkan",3.9,5,Türkiye
Kayıp Şehir Z,The Lost City of Z,"Macera, Biyografi, Aksiyon",James Gray,4/21/2017,"11,092","159,354", Dede Gardner; ‎Jeremy Kleiner‎,"Charlie Hunnam, Robert Pattinson, Sienna Miller",6.6,3,ABD
Prenses ve Kurbağa: Ajanlar İş Başında,The Swan Princess: Royally Undercover,Animasyon,Richard Rich,6/9/2017,"11,048","116,336"," Richard Rich, Jared F. Brown, Seldon Young","Laura Bailey, Yuri Lowenthal, Joseph Medrano",3.7,4,"ABD, Güney Kore, Hindistan"
Paterson,,"Komedi, Dram",Jim Jarmusch,2/24/2017,"11,068","114,998","Carter Logan, Joshua Astrachan, Ron Bozman","Adam Driver, Sterling Jerins, Golshifteh Farahani",7.3,19,"ABD, Almanya, Fransa"
Nereden Nereye,,Komedi,Volkan Dönmez,4/28/2017,"10,506","126,382",Insignia,"İnan Ulaş Torun, Yosi Mizrahi, Hakan Bilgin",3.5,3,Türkiye
Bahtiyar Bahtıkara,,Komedi,Ergin Yılmazer,5/19/2017,"10,471","110,055",RNK Film,"Kadir Çöpdemir, Ferdi Sancar, Metin Zakoğlu",4.4,3,Türkiye
Durak,,Gerilim,"Serdar Gözelekli, Muammer Koçak",7/14/2017,"10,460","117,741",İkinci Yeni Film Yapım,"Emre Altuğ, Görkem Yeltan, Deniz Hamzaoğlu",5.5,2,Türkiye
Tutku Oyunu,L'amant double,"Gerilim, Aşk, Dram",François Ozon,9/8/2017,"10,418","133,803","Eric Altmeyer, Nicolas Altmeyer","Jeremie Renier, Jacqueline Bisset, Marine Vacth",6.2,11,"Belçika, Fransa"
Dönme Dolap,Wonder Wheel,Dram,Woody Allen,12/22/2017,"19,893","297,065","Letty Aronson, Edward Walson, Erika Aronson","Kate Winslet, Justin Timberlake, Juno Temple",6.2,11,ABD
İlk Kurşun,First Kill,"Gerilim, Aksiyon",Steven C. Miller,9/1/2017,"10,141","137,933"," George Furla, Randall Emmett, Mark Stewart","Bruce Willis, Hayden Christensen, Ty Shelton",5.0,5,ABD
Dalida,,"Dram, Biyografi",Lisa Azuelos,4/28/2017,"10,236","138,432","Lisa Azuelos, Julien Madon, Jérôme Seydoux","Riccardo Scamarcio, Sveva Alviti, Jean-Paul Rouve",6.9,19,Fransa
İki,,"Korku, Gerilim","Fatih Gürler, Ramazan Özer",8/4/2017,"9,851","106,988","UFP, Efektif Sanat","Emin Gümüşkaya, Tuğba Tutuğ, Tuana Naz Tiryaki",3.3,3,Türkiye
Kaçış Odası,Escape Room,Korku,Peter Dukes,9/22/2017,"9,809","104,380",Neal H. Moritz; Ori Marmur‎,"Skeet Ulrich, Sean Young, Christine Donlon",4.3,12,ABD
İçeride,Shut In,Gerilim,Farren Blackburn,1/27/2017,"9,628","126,584","Claude Léger, Luc Besson, Sylvain Proulx","Naomi Watts, Jacob Tremblay, Oliver Platt",4.8,2,"ABD, Fransa, Kanada"
Kara Gün,Patriots Day,"Gerilim, Dram, Tarihi",Peter Berg,6/23/2017,"9,572","137,376","Mark Wahlberg, Scott Stuber, Stephen Levinson","Mark Wahlberg, Kevin Bacon, Michelle Monaghan",7.3,3,ABD
Kayseri Aslanı: Çin İşi,,Komedi,Ali Demirel,10/13/2017,"9,477","96,507",TFI,"İnan Ulaş Torun, Algı Eke, Asuman Dabak",3.8,5,Türkiye
Umut Bahçesi,The Zookeeper's Wife,"Dram, Biyografi",Niki Caro,3/31/2017,"9,461","149,292","Diane Miller Levin, Kim Zubick, Jamie Patricof","Daniel Brühl, Jessica Chastain, Johan Heldenbergh",7.0,3,ABD
