Film_Adi_TR,Film_Adi_Yabanci,Film_Turu,Yonetmen,Vizyon_Tarihi,Seyirci_Sayisi,Toplam_Hasilat,Yapimci,Oyuncular,IMDb,Gosterim_Hafta,Yapimci_Ulke
Ölüm Günün Kutlu Olsun 2,Happy Death Day 2U,"Korku, Gerilim, Gizem",Christopher Landon,2/22/2019,"137,211","2,229,296", Jason Blum,"Jessica Rothe, Israel Broussard, Ruby Modine",6.2,5,ABD
Kırk Yalan,,Komedi,Hamdi Alkan,12/20/2019,"143,746","2,518,923",Erdi Yapım,"Oğuzhan Uğur, Timur Acar, Ferdi Sancar",3.0,8,Türkiye
Addams Ailesi,The Addams Family,"Komedi, Animasyon, Aile, 3 Boyutlu","Conrad Vernon, Greg Tiernan",12/6/2019,"132,798","2,615,787"," Conrad Vernon, Gail Berman, Alex Schwartz","Oscar Isaac, Judi Dench,Charlize Theron",5.8,6,ABD
Hellboy,,"Macera, Fantastik, Aksiyon, IMAX",Neil Marshall,4/12/2019,"131,379","2,275,978","Mike Richardson,Lloyd Levin,Lawrence Gordon","David Harbour, Milla Jovovich, Sasha Lane",5.2,6,ABD
Ölümcül Labirent,Escape Room,"Korku, Gerilim",Adam Robitel,1/31/2019,"117,021","1,770,929","Neal H. Moritz,Ori Marmur","Deborah Ann Woll, Taylor Russell, Tyler Labine",6.4,5,ABD
Charlie'nin Melekleri,Charlie's Angels,"Macera, Komedi, Aksiyon",Elizabeth Banks,11/29/2019,"109,432","2,211,783","Max Handelman,Doug Belgrad,Elizabeth Cantillo","Kristen Stewart, Naomi Scott, Ella Balinska",4.9,4,ABD
Güzelliğin Portresi,,"Gerilim, Dram",Umur Turagay,12/13/2019,"109,438","1,976,435","BKM, CJ ENM","Gizem Erman Soysaldı, Burçin Terzioğlu, Birkan Sokullu",6.3,6,Türkiye
Yeti Efsanesi,Abominable,"Animasyon, 3 Boyutlu","Jill Culton, Todd Wilderman",9/27/2019,"108,504","1,912,201","Peilin Chou,Suzanne Buirgy","Chloe Bennet,Albert Tsai,Tenzing Norgay Trainor",7.0,6,ABD
Araf 2,,Korku,Biray Dalkıran,1/4/2019,"108,451","1,422,922",DFGS,"Emre Kızılırmak, Cevahir Turan, Kaan Songün",2.8,10,Türkiye
Asfaltın Kralları,Le Mans '66,"Dram, Biyografi, Aksiyon",James Mangold,11/15/2019,"106,680","2,408,864","James Mangold,Lucas Foster,Kevin Halloran","Christian Bale, Matt Damon, Caitriona Balfe",8.1,7,"ABD, Fransa"
Anna,,"Gerilim, Aksiyon",Luc Besson,6/20/2019,"105,611","1,782,585","James Wan,Peter Safran","Sasha Luss, Helen Mirren, Luke Evans",6.6,7,Fransa
İkizler Projesi,Gemini Man,"Bilim-Kurgu, Dram, Aksiyon, 3 Boyutlu",Ang Lee,10/11/2019,"104,855","2,016,616","Will Smith,Jerry Bruckheimer,David Ellison","Will Smith, Mary Elizabeth Winstead, Clive Owen",5.7,4,ABD
Creed II: Efsane Yükseliyor,Creed II,"Dram, Spor, Aksiyon",Steven Caple Jr.,1/11/2019,"104,513","1,585,402","Sylvester Stallone,Ian Sharples,Charles Winkler","Michael B. Jordan, Sylvester Stallone, Tessa Thompson",7.1,5,ABD
Terminatör: Kara Kader,Terminator: Dark Fate,"Macera, Bilim-Kurgu, Aksiyon",Tim Miller,11/1/2019,"104,175","2,170,891","James Cameron,David Ellison","Linda Hamilton, Arnold Schwarzenegger, Mackenzie Davis",6.2,5,"ABD, Çin"
Deli ve Dahi,The Professor and the Madman,"Dram, Biyografi, Gizem",Farhad Safinia,3/29/2019,"103,731","1,939,622","Mel Gibson,Bruce Davey,Gastón Pavlovich","Steve Coogan, Mel Gibson, Sean Penn",7.2,12,İrlanda
Ölümcül Sular,Crawl,Korku,Alexandre Aja,7/12/2019,"103,575","1,828,617","Alexandre Aja,Robert Tapert,Sam Raimi","Kaya Scodelario, Barry Pepper, Ross Anderson",6.1,5,ABD
Aslı Gibidir,,Komedi,Ali Yorgancıoğlu,1/25/2019,"102,517","1,360,024",Hann Yapım,"Aslı İnandık, Toygan Avanoğlu, Ahmet Olgun Sünear",4.4,4,Türkiye
Hareket Sekiz,,"Komedi, Aksiyon",Ali Yorgancıoğlu,10/4/2019,"100,551","1,573,654",Dada Vision,"Ali Sunal, Onur Atilla, Devrim Yakut",4.6,7,Türkiye
Parazit,Parasite,"Gerilim, Komedi, Dram",Bong Joon-ho,11/1/2019,"428,752","6,833,458","Jang Young Hwan,Bong Joon Ho","Kang-ho Song, Yeo-jeong Jo, Woo-sik Choi",8.5,33,Güney Kore
Lanetli Gözyaşları,The Curse of La Llorona,"Korku, Gerilim, Gizem",Michael Chaves,4/19/2019,"97,160","1,598,089","James Wan,Gary Dauberman,Emile Gladstone","Linda Cardellini, Patricia Velasquez, Madeleine McGraw",5.2,5,ABD
Ayı Kardeşler: Zamanda Yolculuk,Boonie Bears: Blast Into The Past,Animasyon,Leon Ding,11/15/2019,"100,942","1,592,313",Huang Ziyan,"Chris Boike,Joseph S. Lambert,Siobhan Lumsden",5.4,21,Çin
Sir-Ayet,,Korku,Onur Aldoğan,2/8/2019,"89,994","1,357,434",Enis Özkan Film,"Demet Oran, Aydan Akboğa, Sinan Taşkan",2.8,9,Türkiye
After,,"Aşk, Dram",Jenny Gage,4/12/2019,"87,377","1,436,802","Anna Todd,Courtney Solomon,Mark Canton","Selma Blair, Hero Fiennes Tiffin, Peter Gallagher",5.2,7,ABD
Corgi,The Queen's Corgi,"Animasyon, 3 Boyutlu","Ben Stassen, Vincent Kesteloot",4/26/2019,"87,329","1,365,703",Ben Stassen," Jo Wyatt, Leo Barakat, Rusty Shackleford",4.8,13,Belçika
Dora ve Kayıp Altın Şehri,Dora and the Lost City Of Gold,"Macera, Aile, Aksiyon",James Bobin,8/9/2019,"85,387","1,401,637",Kristin Burr,"Isabela Merced, Michael Pena, Eva Longoria",6.1,7,"ABD, Avustralya"
Biz,Us,"Korku, Gerilim",Jordan Peele,3/22/2019,"83,957","1,475,973","Jordan Peele,Jason Blum,Jason Blum","Lupita Nyong'o, Winston Duke, Elisabeth Moss",6.8,15,ABD
Kadavra,The Possession of Hannah Grace,"Korku, Gizem",Diederik Van Rooijen,3/15/2019,"80,876","1,367,644","Sean Robins,Sean Robins","Shay Mitchell, Grey Damon, Kirby Johnson",5.2,4,ABD
Kaçış Planı 3,Escape Plan: The Extractors,"Gerilim, Aksiyon",John Herzfeld,7/12/2019,"80,065","1,271,093","Mark Canton,Robbie Brenner,Zack Schiller","Sylvester Stallone, Dave Bautista, 50 Cent",4.4,5,ABD
Uçan Halı ve Kayıp Elmas,"Up and Away, Hodja fra Pjort","Animasyon, Aile",Karsten Kiilerich,1/18/2019,"83,086","995,103","Kim Magnusson,Anders Mastrup,Tivi Magnusson"," Thure Lindhardt, Özlem Saglanmak, Birgitte Raaberg",5.4,53,Danimarka
Kartopu Savaşları 2,Snowtime! 2,Animasyon,Benoit Godbou,3/8/2019,"73,330","1,012,080",Marie-Claude Beauchamp," Céline Ronte, Thomas Sagols",5.5,15,Kanada
Replikalar,Replicas,"Bilim-Kurgu, Suç, Gizem",Jeffrey Nachmanoff,1/11/2019,"72,407","1,067,415","Keanu Reeves,Stephen Hamel,Lorenzo di Bonaventura","Keanu Reeves, Alice Eve, John Ortiz",5.4,6,"ABD, Birleşik Krallık, Çin, Porto Riko"
Yalan Dolan,,Komedi,Michael Şahin Derun,3/1/2019,"71,474","1,097,779",Eser Yapım,"Şafak Sezer, Çetin Altay, Burcu Binici",4.5,5,Türkiye
Asteriks: Sihirli İksirin Sırrı,Astérix: Le secret de la potion magique,Animasyon,"Alexandre Astier, Louis Clichy",2/15/2019,"68,847","1,039,313",Natalie Altmann,"Bernard Alane, Christian Clavier, Guillaume Briat",6.7,16,Fransa
Natalie Altmann,,"Komedi, Aile",Mustafa Kotan,8/9/2019,"68,415","641,231",Hann Yapım,"Emir Özyakışır, Ayça Erturan, Ferit Aktuğ",3.9,18,Türkiye
Kod Adı: Angel,Angel Has Fallen,"Gerilim, Dram, Aksiyon",Ric Roman Waugh,8/23/2019,"62,722","1,200,847"," Gerard Butler, John Thompson, Alan Siegel","Gerard Butler, Morgan Freeman, Piper Perabo",6.4,8,ABD
Kuzular Kurtlara Karşı 2,"Volki i ovtsy. Khod sviney, Sheep and Wolves 2","Animasyon, 3 Boyutlu",Vladimir Nikolaev,3/22/2019,"61,034","955,761"," Vladimir Nikolaev, Yuriy Moskvin, Sergey Selyanov"," Alexander Petrov (II), Sergey Bezrukov, Elizaveta Boyarskaya",5.1,12,Rusya
Van Gogh: Sonsuzluğun Kapısında,At Eternity's Gate,"Dram, Biyografi",Julian Schnabel,2/15/2019,"60,910","859,530","Jon Kilik, Charles-Marie Anthonioz","Willem Dafoe, Rupert Friend, Oscar Isaac",6.9,23,"ABD, Birleşik Krallık, Fransa, İrlanda, İsviçre"
BTS World Tour: Love Yourself in Seoul,,"Belgesel, Konser, Müzik",Son Sung-deuk,1/26/2019,"60,437","1,090,893",Big Hit Entertainment,"BTS, J-Hope, Jeong-guk Jeon",9.0,3,Güney Kore
Alem-i Cin 2,,"Korku, Gerilim",Özgür Bakar,5/3/2019,"
58.750","901,583",Film Fabrikası,"Ali Kaan Serez, Bekir Behrem, Savaş Barutçu",3.9,4,Türkiye
Cinnet,,Korku,Aytekin Birkon,6/14/2019,"57,537","848,886",TAFF,"Yeliz Akkaya, Emre Başer, Nicholas Facey",3.3,5,Türkiye
Şuursuz Aşk,,Dram,Umut Ertek,12/27/2019,"
76.251","1,374,752",Şeddadi Yapım,"İsmail Hacıoğlu, Ebru Şahin, Burcu Kara",6.0,7,Türkiye
Rambo: Son Kan,Rambo: Last Blood,"Macera, Aksiyon",Adrian Grunberg,9/20/2019,"54,244","937,918"," Kevin King Templeton, Avi Lerner, Yariv Lerner","Sylvester Stallone, Paz Vega, Yvette Monreal",6.1,4,ABD
Efsunlu - Kabirden Gelen,,Korku,Uğur Kaplan,7/5/2019,"54,044","804,314",Enis Özkan Film,"Sedef Şahin, Reyhan İlhan, Elif Kartal",3.5,6,Türkiye
Doktor Uyku,Doctor Sleep,"Korku, Gerilim",Mike Flanagan,11/22/2019,"50,452","944,551","Stephen King, Trevor Macy, Jon Berg","Ewan McGregor, Rebecca Ferguson, Kyliegh Curran",7.3,4,ABD
Cin Azabı,,Korku,Onur Aldoğan,9/13/2019,"49,400","741,512","Cinemoon Film, CNS","Aydan Akboğa, Yalın Cengiz, Nalan Olcayalp",2.4,7,Türkiye
Rambo: Son Kan,Rambo: Last Blood,"Macera, Aksiyon",Adrian Grunberg,9/20/2019,"54,244","937,918","Kevin King Templeton, Avi Lerner, Yariv Lerner,","Sylvester Stallone, Paz Vega, Yvette Monreal",6.1,4,ABD
Sesinde Aşk Var,,"Gençlik, Romantik",Osman Taşçı,8/16/2019,"48,855","735,834",Limon Film,"Burak Tozkoparan, Hayal Köseoğlu, Gizem Güneş",4.5,5,Türkiye
Luis ve Uzaylı Dostları,Luis and the Aliens,Luis and the Aliens,"Christoph Lauenstein, Wolfgang Lauenstein",8/2/2019,"
53.623","806,568"," Emely Christians, Christine Parisse, Anders Mastrup","Callum Maloney, Dermot Magennis, Ian Coppinger",6.0,25,"Almanya, Danimarka, Lüksemburg"
Sarayın Gözdesi,The Favourite,Dram,Yorgos Lanthimos,2/8/2019,"47,732","863,699","Yorgos Lantimos, Ed Guiney, Ceci Dempsey,","Olivia Colman, Rachel Weisz, Emma Stone",7.5,7,"ABD, Birleşik Krallık, İrlanda"
Kulyas: Lanetin Bedeli,,Korku,Yunus Şevik,5/10/2019,"46,200","659,328",Dras Film Pictures,"Halil Kumova, Kübra Kılınçkaya, Nurdan Paksoy",3.4,10,Türkiye
Acemi Kaşifler: Görevimiz Kocaayak,Mission Kathmandu: The Adventures of Nelly & Simon,"Macera, Komedi, Animasyon","Pierre Greco, Nancy Florence Savard",5/24/2019,"44,891","610,634"," Nancy Florence Savard, Geneviève Savard"," Nancy Florence Savard, Geneviève Savard",5.1,13,Kanada
Midway,,"Dram, Savaş, Aksiyon",Roland Emmerich,11/29/2019,"44,544","903,983","Roland Emmerich, Harald Kloser","Ed Skrein, Patrick Wilson, Luke Evans",6.7,6,"ABD, Çin"
Bring The Soul: The Movie,,"Belgesel, Müzik",Park Jun-Soo,8/7/2019,"42,476","733,421",Hybe Corporation,"RM, Jin, Suga",8.4,3,Güney Kore
Kefernahum,Capharnaüm,Dram,Nadine Labaki,1/25/2019,"41,399","503,926","Khaled Mouzanar, Michel Merkt","Zain Al Rafeea, Yordanos Shiferaw, Boluwatife Treasure Bankole",8.4,30,"ABD, Lübnan"
Ritüel,Midsommar,"Korku, Dram, Gizem",Ari Aster,7/26/2019,"40,832","747,347",Patrik Andersson; Lars Knudsen,"Florence Pugh, Will Poulter, Jack Reynor",7.1,15,ABD
Kapı,,Dram,Nihat Durak,4/12/2019,"41,328","631,778","TAFF, Durak Film","Kadir İnanır, Vahide Perçin, Timur Acar",6.9,5,Türkiye
Araf 3: Cinler Kitabı,,Korku,Biray Dalkıran,11/1/2019,"39,036","627,118",DFGS,"Mehmet Baştürk, Çağla Erdimen, Emre Özmen",4.8,12,Türkiye
Sevimli Ejderha Kokonat: Ormanda Şenlik,Coconut The Little Dragon: Into The Jungle,Animasyon,Anthony Power,3/29/2019,"38,111","441,648","Gabriele M. Walther, Marcus Hamann","Carolin Kebekus, Dustin Semme Irogge, Maxvon Der Groeben",5.6,28,Almanya
Düzenbazlar,The Hustle,Komedi,Chris Addison,5/31/2019,"36,882","722,858","Rebel Wilson, Roger Birnbaum","Anne Hathaway, Rebel Wilson, Tim Blake Nelson",5.4,6,ABD
Hüddam 2,,Korku,Utku Uçar,3/8/2019,"36,706","548,612",Hayal Sanat,"Ebrar Kurt, Bülent Kaya, Hakan Erkuran",4.9,5,Türkiye
Süper Ayı,Super Bear,Animasyon,Wang Qi,1/4/2019,"36,656","420,741",Song Xianwei,"Jeff Dunham, Marcus Shor, Morena Cleese",4.0,24,Çin
Ali,,Dram,Ramazan Özer,3/22/2019,"36,401","534,186",Efektif Sanat,"Gürbey İleri, Hakan Meriçliler, Semra Dinçer",4.3,3,Türkiye
Tabaluga,Tabaluga,"Animasyon, 3 Boyutlu",Sven Unterwaldt Jr.,3/1/2019,"35,433","487,497","Helge Sasse, Solveig Fina"," Michael Herbig, Yvonne Catterfeld, Heinz Hoenig",5.2,20,Almanya
Abigail: Sınırların Ötesinde,Abigail,"Macera, Fantastik, Aksiyon",Aleksandr Boguslavskiy,8/30/2019,"34,820","560,968",Evgeniy Melentev.,"Tinatin Dalakishvili, Eddie Marsan, Rinal Mukhametov",4.8,3,"ABD, Rusya"
Astral Seyahat,,Korku,Hasan Gökalp,5/31/2019,"34,603","540,393","Dada Vision, İgamedya Yayıncılık","Pervin Abiyeva, Büşra Acar, Çağdaş Tekelioğlu",1.6,6,Türkiye
Geçmiş Olsun,,Komedi,Hasan Doğan,6/28/2019,"34,134","527,356",Juli Sanat,"Toygan Avanoğlu, Cihan Şimşek, Müge Boz",3.7,4,Türkiye
Sir-Ayet 2,,Korku,Kayhan Başoğlu,9/27/2019,"33,501","537,305",Enis Özkan Film,"Üzeyir Ulus, Mehmet Aras, Arzu Suriçi Kireççi",4.7,5,Türkiye
Kuyu,The Hole in the Ground,Korku,Lee Cronin,6/14/2019,"33,051","480,208","John Keville, Conor Barry","Seána Kerslake, James Quinn Markey, Simone Kirby",5.6,3,İrlanda
Sihirli Oyuncaklar,Toys & Pets,"Macera, Animasyon",Gary Wang,5/10/2019,"32,940","475,410","Zhou Yu, Ye Yuan","Shi Lei, Yuan Zeyu, Guanlin Ji",5.6,9,Çin
New York'ta Yağmurlu Bir Gün,A Rainy Day in New York,Komedi,Woody Allen,8/30/2019,"32,707","706,152","Letty Aronson ,","Timothée Chalamet, Elle Fanning, Selena Gomez",6.5,8,ABD
Sibel,,Dram,"Guillaume Giovanetti, Çağla Zencirci",2/22/2019,"33,725","410,163",Mars Production,"Damla Sönmez, Erkan Kolçak Köstendil, Emin Gürsoy",6.8,26,"Türkiye, Almanya, Fransa, Lüksemburg"
Kız Kardeşler,,Dram,Emin Alper,9/13/2019,"32,202","566,692","NuLook, Liman Film","Cemre Ebuzziya, Ece Yüksel, Helin Kandemir",7.5,7,"Türkiye, Almanya, Hollanda, Yunanistan"
Alev Almış Bir Genç Kızın Portresi,Portrait Of A Lady On Fire,"Dram, Tarihi, Romantik",Céline Sciamma,12/6/2019,"43,049","717,319",Bénédicte Couvreur,"Noémie Merlant, Adèle Haenel, Luàna Bajrami",8.1,26,Fransa
Herkes Biliyor,Everybody Knows,"Gerilim, Dram, Gizem",Asghar Farhadi,3/8/2019,"31,593","383,532","Alexandre Mallet-Guy, Alvaro Longoria","Penélope Cruz, Javier Bardem, Ricardo Darín",6.9,17,"Fransa, İspanya, İtalya"
Astronot Willy: Macera Gezegeni,Terra Willy: Planète inconnue,"Macera, Komedi, Animasyon",Eric Tosti,7/12/2019,"31,208","493,055","Jean-François Tosti, Frédéric Fiore","Timothé Vom Dorp, Edouard Baer, Barbara Tissier",6.6,13,Fransa
Kediler,Cats and Peachtopia,Animasyon,Gary Wang,8/30/2019,"32,612","480,313","Zhou Yu, Ye Yuan","Dermot Mulroney, Brittany Curran",4.8,22,Çin
Ecinni: Tılsımlı Mezar,,Korku,Mehmet Sağlam,7/19/2019,"27,891","409,934",Sağlam Film,"Önem Pişkin, Berkay Berkman, Elis Büşra Kılıç",2.3,5,Türkiye
Hızlı ve Tüylü,Manou the Swift,Animasyon,"Christian Haas, Andrea Block",9/20/2019,"35,955","514,085"," Christian Haas, Andrea Block, Michael Roesch"," Cassandra Steen, Josh Keaton, Willem Dafoe",5.4,46,Almanya
Eşek Kral,The Donkey King,"Komedi, Animasyon, Aile",Aziz Jindani,12/20/2019,"33,237","523,147",Ghazi Ali,"Shafaat Ali, Vasay Chaudhry, Hina Dilpazir",6.1,18,Pakistan
Skandal,Bombshell,"Dram, Biyografi",Jay Roach,12/20/2019,"30,617","820,194"," Charlize Theron, Jay Roach, Charles Randolph","Margot Robbie, Charlize Theron, Nicole Kidman",6.8,7,"ABD, Kanada"
Kahraman Balık,Go Fish,"Macera, Animasyon",Sean Patrick O'Reilly,12/6/2019,"27,787","494,173","Guinevere Turner, Rose Troche"," Justine Ezarik, Mark Hamill, Ron Perlman",4.6,14,ABD
Akıllara Seza,,Romantik-Komedi,Serdal Genç,7/19/2019,"25,187","359,790",2506,"İnan Ulaş Torun, Haldun Boysan, Aslıhan Güner",6.4,4,Türkiye
Acı ve Zafer,Pain & Glory,Dram,Pedro Almodóvar,10/11/2019,"26,576","538,543"," Agustín Almodóvar, Esther García, Ignacio Salazar-Simpson","Antonio Banderas, Penélope Cruz, Cecilia Roth",7.5,19,İspanya
Korku Hikayeleri,Scary Stories to Tell in the Dark,Korku,André Øvredal,8/23/2019,"25,165","452,056"," Guillermo del Toro, Jason F. Brown, Sean Daniel","Zoe Margaret Colletti, Michael Garza, Gabriel Rush",6.2,4,"ABD, Kanada"
Karışma Bende,,Komedi,Kamil Çetin,10/18/2019,"24,881","428,351","ILS Vision, TN Yapım","Sefa Kındır, Mami Emen, Sinan Poyraz",1.2,4,Türkiye
Yesterday,Yesterday,"Komedi, Fantastik, Müzik",Danny Boyle,6/28/2019,"24,527","467,088", George Martin,"Himesh Patel, Lily James, Ed Sheeran",6.8,8,Birleşik Krallık
Uglydolls,Uglydolls,Animasyon,Kelly Asbury,5/17/2019,"24,130","383,345"," Vivian WANG, Robert Rodriguez, Jane Hartwell","Kelly Clarkson, Pitbull, Lee-Hom Wang",5.1,6,ABD
Kapan,,"Dram, Aksiyon",Kudret Sabancı,3/8/2019,"23,706","349,126",Nehir Yapım,"Erkan Petekkaya, Kemal Uçar, Öykü Çelik",5.1,3,Türkiye
Olacak İş Değil,The Upside,"Komedi, Dram",Neil Burger,1/25/2019,"23,656","379,909"," Jason Blumenthal, Todd Black, Steve Tisch","Bryan Cranston, Kevin Hart, Nicole Kidman",7.0,9,ABD
Ma,Ma,"Korku, Gerilim",Tate Taylor,5/31/2019,"22,854","394,174","Jason Blum, John Norris, Tate Taylor","Octavia Spencer, Diana Silvers, Luke Evans",5.6,3,ABD
Aşgar: Cin Vadisi,,Korku,Yahya Al,4/12/2019,"22,729","316,301","B Kare Film, NKB Yapım","Hayrettin Batur, Cemre Akyıldız, Buğra Kağan Kahraman",4.1,5,Türkiye
Şeytan-i İns,,Korku,Gökhan Arı,3/22/2019,"22,627","347,963",Suare Film,"Emre Özmen, Derya Çavuşoğlu, Bertan Dirikolu",3.4,4,Türkiye
Jumbo,Jumbo,Animasyon,James Snider,3/29/2019,"22,274","321,215","Pascaline Saillant, Gilles Chanial, Anaïs Bertrand","Maria Petrano, Thomas Carr",3.1,5,ABD
Hello Kitty,Hello Kitty,Animasyon,Tony Oliver,4/19/2019,"21,995","367,365",Beau Flynn,"Sarah Anne Williams, Lindsay Sheppard, Nicholas Andrew Louie",8.9,3,Japonya
Rocketman,Rocketman,"Dram, Biyografi, Müzik",Dexter Fletcher,6/14/2019,"21,899","360,588","Elton John, Adam Bohling, David Reid","Taron Egerton, Bryce Dallas Howard, Jamie Bell",7.3,8,Birleşik Krallık
Merhaba Güzel Vatanım,,Dram,Cengiz Özkarabekir,11/1/2019,"21,829","419,475",Batı İstanbul Vakfı,"Yetkin Dikinciler, Serkan Altıntaş, Berna Laçin",5.0,4,Türkiye
Soğuk İntikam,Cold Pursuit,"Gerilim, Dram, Aksiyon",Hans Petter Moland,3/22/2019,"20,886","379,137"," Michael Shamberg, Stein B. Kvae, Finn Gjerdrum","Emmy Rossum, Liam Neeson, Julia Jones",6.2,4,Birleşik Krallık
Beyaz Hüzün,,"Dram, Tarihi",Kenan Korkmaz,12/20/2019,"54,427","602,315",Ekol Yapım,"Kenan Korkmaz, Murat Yatman, Duygu Poyraz",5.1,13,Türkiye
Tolkien,Tolkien,"Dram, Biyografi",Dome Karukoski,7/5/2019,"20,106","371,317"," Peter Chernin, Kris Thykier, Jenno Topping","Nicholas Hoult, Lily Collins, Pam Ferris",6.8,3,ABD
Kuşatma 7 Uyuyanlar,,"Dram, Aksiyon",Utku Uçar,10/4/2019,"19,990","298,683",Küsena Film Yapım,"Ahmet Şafak, Fulden Akyürek, Özcan Varaylı",5.4,4,Türkiye
Greta,Greta,"Gerilim, Dram, Gizem",Neil Jordan,4/19/2019,"19,939","254,030"," Lawrence Bender, James Flynn, Sidney Kimmel","Colm Feore, Isabelle Huppert, Chloe Grace Moretz",6.0,5,"ABD, İrlanda"
Hayatta Olmaz,,Komedi,Emre Çaltılı,4/19/2019,"19,798","187,191",Emr Medya,"İnan Ulaş Torun, Ceyhun Fersoy, Ceyhun Yılmaz",5.4,6,Türkiye
Özgür Dünya,,"Aşk, Dram, Gençlik","Şevki Es, Faruk Aksoy",3/22/2019,"19,317","298,749","Ay Yapım, Med Yapım","Murat Serezli, Rabia Soytürk, Gürbey İleri",2.3,3,Türkiye
Marid,,Korku,Kemal Özdemir,3/15/2019,"18,852","278,064",Vidd Film,"Onur Bilgin, Hilal Anay, Mustafa Mutlu",5.1,3,Türkiye
Kara Noel,Black Christmas,"Korku, Gerilim, Gizem",Sophia Takal,12/27/2019,"21,013","460,813"," Jason Blum, Adam Hendricks, Ben Cosgrove","Cary Elwes, Imogen Poots, Brittany O'Grady",3.5,3,"ABD, Yeni Zelanda"
Yaramazlar Takımı: Zaman Yolcuları,Kikoriki: Deja Vu,Animasyon,Denis Chernov,5/31/2019,"19,989","291,231","Fyodor Bondarchuk , Dmitriy Rudovskiy","İlham Erdoğan, Arda Kavaklıoğlu, Nur Eraslan",5.5,22,Rusya
Papillon,Papillon,Dram,Michael Noer,3/8/2019,"18,464","352,700"," Joey McFarland, Roger Corbi, Ram Bergman","Charlie Hunnam, Rami Malek, Tommy Flanagan",7.2,5,"ABD, Çek Cumhuriyeti, İspanya"
Katil Avcısı,Hunter Killer,"Gerilim, Aksiyon",Donovan Marsh,3/29/2019,"18,431","325,648","Gerard Butler, Mark Gill, Alan Siegel","Gerard Butler, Gary Oldman, Common",6.6,2,"ABD, Birleşik Krallık, Çin"
Korkunun Sesi,Echoes of Fear,Korku,"Brian Avenet-Bradley, Laurence Avenet-Bradley",11/29/2019,"18,386","332,704","Laurence Avenet-Bradley, Patrick DiCesare","Trista Robinson, Hannah Race, Paul Chirico",5.1,3,ABD
Destroyer,Destroyer,"Dram, Suç, Aksiyon",Karyn Kusama,4/19/2019,"18,234","348,420"," Fred Berger, Phil Hay, Matt Manfredi","Nicole Kidman, Tatiana Maslany, Sebastian Stan",6.2,5,ABD
İskoçya Kraliçesi Mary,Mary Queen of Scots,"Dram, Tarihi, Biyografi",Josie Rourke,2/1/2019,"18,057","331,125"," Tim Bevan, Eric Fellner, Debra Hayward","Margot Robbie, Saoirse Ronan, Guy Pearce",6.3,4,Birleşik Krallık
Koruyucu,The Bouncer,Aksiyon,Julien Leclercq,7/26/2019,"17,456","277,696",Julien Madon,"Jean-Claude Van Damme, Sami Bouajila, Sveva Alviti",5.9,2,"Belçika, Birleşik Krallık"
Ve Sonra Dans Ettik,And Then We Danced,"Dram, Romantik",Levan Akin,11/15/2019,"18,525","301,639"," Mathilde Dedye, Ketie Danelia","Levan Gelbakhiani, Bachi Valishvili, Ana Javakishvili",7.6,17,"Fransa, Gürcistan, İsveç"
Temizlikçi,The Cleaning Lady,"Korku, Gerilim",Jon Knautz,5/10/2019,"16,965","279,443","Melissa Carter, Shay Mitchell ve Michael Offer ","Alexis Kendra, Stelio Savante, Rachel Alig",5.5,3,ABD
Bir Şans Daha,Last Christmas,"Romantik-Komedi, Dram",Paul Feig,11/29/2019,"16,953","419,368"," Emma Thompson, Paul Feig, Jessie Henderson","Emilia Clarke, Henry Golding, Emma Thompson",6.5,3,"ABD, Birleşik Krallık"
"Cin ""Aşk Büyüsü""",,Korku,Battal Karslıoğlu,7/26/2019,"16,450","237,124",Trio Pictures A.Ş.,"Soner Türker, Derya İpek, Ali Ertem",1.6,5,Türkiye
Arakçılar,Shoplifters,"Dram, Suç",Hirokazu Koreeda,1/18/2019,"16,361","185,149"," Matsuzaki Kaoru, Yose Akihiko, Taguchi Hijiri","Lily Franky, Sakura Andô, Mayu Matsuoka",7.9,14,Japonya
Suikastçı,The Assassin's Code,"Gerilim, Aksiyon",David A. Armstrong,5/3/2019,"15,396","259,162"," David A. Armstrong, Edward Lee Cornett, William K. Baker","Justin Chatwin, Peter Stormare, Mark Thompson",5.1,3,"ABD, Kanada"
Kız,Girl,Dram,Lukas Dhont,1/4/2019,"15,224","175,581",Dirk Impens,"Victor Polster, Arieh Worthalter, Oliver Bodart",7.1,14,"Belçika, Hollanda"
Cin-si Bozuk,,"Korku, Komedi",Bilal Kalyoncu,9/6/2019,"14,744","233,508",2506,"Barbaros Dikmen, Doğa Konakoğlu, Nora Tokhosepyan",3.6,3,Türkiye
Sır Tutabilir Misin?,Can You Keep a Secret?,"Komedi, Romantik",Elise Duran,8/16/2019,"14,463","271,870"," Brian Keady, Claude Dal Farra, Brice Dal Farra","Alexandra Daddario, Tyler Hoechlin, Kimiko Glenn",5.3,3,ABD
Şüphe,Burning,"Dram, Gizem",Chang-dong Lee,1/11/2019,"15,005","15,005", Ok Gwang-hee,"Ah-In Yoo, Steven Yeun, Seong-kun Mun",7.5,17,Güney Kore
Bana Bir Aşk Şarkısı Söyle,,"Aşk, Dram",Mehrdad Ghaffarzadeh,3/29/2019,"14,201","210,726",Hüzzam Film,"Yusuf Çim, Afsaneh Pakroo, Ali Burak Ceylan",5.5,3,Türkiye
Hotel Mumbai,Hotel Mumbai,"Dram, Tarihi, Biyografi",Anthony Maras,6/21/2019,"14,088","279,544"," Basil Iwanyk, Gary Hamilton, Andrew Ogilvie","Dev Patel, Armie Hammer, Nazanin Boniadi",7.6,5,"ABD, Avustralya"
Hapşuu,,Animasyon,Kenan Öztürk,11/8/2019,"14,077","231,158",Siyah Martı,Lemi Filozof,0.0,4,Türkiye
Güzel Oğlum,Beautiful Boy,Dram,Felix van Groeningen,3/15/2019,"13,873","207,753"," Dede Gardner, Jeremy Kleiner, Brad Pitt","Steve Carell, Timothée Chalamet, Maura Tierney",7.3,10,ABD
Kahraman Prens Sualtı Maceraları,The Underwater Adventures of Sadko,"Komedi, Animasyon","Maksim Volkov, Vitaly Mukhametzyanov",6/28/2019,"13,527","194,108",CTB Film Company,"Mikhail Efremov, Lubov Novikova, Ekaterina Varnava",3.9,9,Rusya
Çat Kapı Aşk,,Romantik-Komedi,Erhan Baytimur,3/22/2019,"13,496","207,612",Filmzade,"Müge Boz, Jess Molho, Nergis Kumbasar",3.2,3,Türkiye
Asla Gözlerini Kaçırma,Never Look Away,"Gerilim, Dram, Tarihi",Florian Henckel von Donnersmarck,2/8/2019,"13,410","190,242"," Quirin Berg , Florian Henckel von Donnersmarck , Jan Mojto ","Tom Schilling, Sebastian Koch, Paula Beer",7.7,13,"Almanya, İtalya"
Küçük Şeyler,,"Komedi, Dram",Kıvanç Sezer,11/29/2019,"13,995","224,447",Asteros,"Alican Yücesoy, Başak Özcan, Bülent Emrah Parlak",6.5,9,Türkiye
Hemen Döneriz,,Komedi,Haydar Işık,11/29/2019,"13,355","158,658",Vega Ajans,"Kadir Polatcı, Murat Genç, Burak Satıbol",5.5,4,Türkiye
Elfland - Yeni Yıl Dedektifleri,Elfland,Animasyon,Logan Spence,12/20/2019,"13,691","255,310",Jennifer Fourteen,"Simon Hill, Kj Schrock, Sarah Taylor",2.9,6,ABD
Mucize Uğur Böceği,The Ladybug,Animasyon,Ding Shi,2/8/2019,"12,868","153,123","Barry Brooker , Stan Wertlieb ,","Haylie Duff, Jon Heder, Norm Macdonald",4.6,10,Çin
Meteler,,"Savaş, Aksiyon",Burak Akyol,4/19/2019,"12,856","198,322",Jineps Yapım,"Gökhan Mumcu, Serhan Çeliker, Temmuz Gürkan Karaca",4.2,4,Türkiye
Gölge Savaşçı,Shadow,"Dram, Savaş, Aksiyon",Yimou Zhang,5/10/2019,"12,852","223,948","Derek Yee, Ellen Eliasoph","Chao Deng, Li Sun, Ryan Zheng",7.0,3,ÇİN
Söz Vermiştin,,"Aşk, Dram",Baran Seyhan,11/15/2019,"12,750","₺225,411",Sarmaşık Sanatlar,"Emre Karayel, Aslı Tandoğan, Şenay Gürler",3.6,1,türkiye
Sınır,"Gräns, Border","Aşk, Fantastik, Dram",Ali Abbasi,5/24/2019,"164,158","164,158","Nina Bisgaard, Peter Gustafsson, Petra Jonsson","Eva Melander, Eero Milonoff, Jörgen Thorsson",7.0,8,"Danimarka, İsveç"
Kim Daha Mutlu?,,"Komedi, Aile",Hakan Haksun,8/24/1933,"178,400","178,400",BSK Yapım,"Ecem Özkaya Üstündağ, Emre Kıvılcım, Hasan Denizyaran",3.1,2,TÜRKİYE
Yangın Yeri,Wildlife,Dram,Paul Dano,1/4/2019,"12,252","197,321","Andrea Queralt, Mani Mortazavi, Xavi Font","Jake Gyllenhaal, Carey Mulligan, Ed Oxenbould",6.8,7,ABD
İstila Altında,Captive State,"Gerilim, Bilim-Kurgu",Rupert Wyatt,3/15/2019,"11,879","214,544","Rupert Wyatt, David Crockett","Vera Farmiga, John Goodman, Madeline Brewer",6.0,3,ABD
Görülmüştür,,Dram,Serhat Karaaslan,9/20/2019,"
12.110","160,577",Film Yapım,"Berkay Ateş, Saadet Işıl Aksoy, İpek Türktan Kaynak",6,24,"Türkiye, Almanya, Fransa"
Aşktan Kaçılmaz,"Juliet, Naked","Romantik-Komedi, Dram, Müzik",Jesse Peretz,3/29/2019,"11,597","200,258","Albert Berger, Ron Yerxa, Judd Apatow,","Chris O'Dowd, Rose Byrne, Ethan Hawke",6.6,8,"ABD, Birleşik Krallık"
