Film_Adi_TR,Film_Adi_Yabanci,Film_Turu,Yonetmen,Vizyon_Tarihi,Seyirci_Sayisi,Toplam_Hasilat,Yapimci,Oyuncular,IMDb,Gosterim_Hafta,Yapimci_Ulke
Rafadan Tayfa Galaktik Tayfa,,Animasyon,İsmail Fidan,1/6/2023,"2,746,254","164,255,567",ISF Film Prodüksiyon,"Şirin Giobbi, Levent Kol, Emine Sergen Kazbek",6.1,7,Türkiye
Kutsal Damacana 4,,Komedi,Kamil Çetin,1/20/2023,"921,351","62,308,051",Poll Films,"Şafak Sezer, Ersin Korkut, Müjde Uzman",3.1,5,Türkiye
İllegal Hayatlar,,Komedi,Cenk Çelik,1/13/2023,"647,349","43,805,535","DMC, NETD, WOVIE","Mahsun Karaca, Şahin Sarsu, Mehmet Kahraman",7.0,6,Türkiye
Çizmeli Kedi: Son Dilek,Puss in Boots: The Last Wish,"Macera, Komedi, Animasyon","Januel Mercado, Joel Crawford",1/27/2023,"624,017","42,843,346",Mark Swift,"Antonio Banderas, Salma Hayek, Harvey Guillen",7.9,4,ABD
Servet Operasyonu,Operation Fortune: Ruse de guerre,"Gerilim, Komedi, Aksiyon",Guy Ritchie,1/13/2023,"116,177","8,545,912",Jason Statham,"Jason Statham, Hugh Grant, Aubrey Plaza",6.7,6,ABD
Demir Kadın: Neslican,,"Dram, Biyografi",Özgür Bakar,1/27/2023,"96,854","6,148,574","CNS Prodüksiyon, Ceylan Yapım, K Yapım","Naz Çağla Irmak, İlker Aksum, Deniz Uğur",7.1,4,Türkiye
Sevda Mecburi İstikamet,,Dram,Çağan Irmak,1/6/2023,"95,678","6,196,974",Orchestra Content,"Selçuk Yöntem, Selin Şekerci, Kubilay Aka",6.5,5,Türkiye
Musallat 3,,Korku,Özgür Bakar,2/3/2023,"85,912","5,822,471",Mia Yapım,"Kurtuluş Şakirağaoğlu, Pelinsu Çileli, İbrahim Aslan",3.1,3,Türkiye
Prestij Meselesi,,"Dram, Müzik",Mahsun Kırmızıgül,2/3/2023,"79,982","6,268,772",Boyut Film,"Engin Hepileri, Eser Yenenler, Aslıhan Güner",6.1,2,Türkiye
Benim Tatlı Diş Perim,My Fairy Troublemaker,"Macera, Komedi, Animasyon",Caroline Origer,1/20/2023,"78,587","5,144,332",Christine Parisse,"Jella Haase, Lisa-Marie Koroll, Alex Avenell",6.8,5,"Almanya, Lüksemburg"
Muhteşem Kedi Maurice,The Amazing Maurice,"Animasyon, Aile, 3 Boyutlu","Toby Genkel, Florian Westermann",1/20/2023,"66,756","4,315,434",Robert Chandler,"Hugh Laurie, Emilia Clarke, Himesh Patel",6.3,5,"Almanya, Birleşik Krallık"
49,,"Dram, Aksiyon",Hakan İnan,1/20/2023,"62,653","3,907,767",CNP Film,"İsmail Hacıoğlu, Hande Doğandemir, Sinan Tuzcu",5.3,5,Türkiye
Mumyalar,Mummies,Animasyon,Juan Jesús García Galocha,2/3/2023,"55,051","4,010,767",Jordi Gasull,"Ana Esther Alborg, Roser Aldabó Arnau, Oscar Barberán",6.1,3,ABD
Megan,M3GAN,"Korku, Gerilim, Bilim-Kurgu",Gerard Johnstone,1/13/2023,"54,347","3,903,069","Blumhouse Productions, Divide/Conquer, Atomic Monster","Allison Williams, Violet McGraw, Amie Donald",6.4,6,ABD
Ainbo: Amazon'da Büyük Macera,Ainbo,Animasyon,"Jose Zelada, Richard Claus",1/27/2023,"51,325","3,552,258",Richard Claus,"Lola Raie, Bernardo De Paula, Thom Hoffman",4.8,4,ABD
Babil,Babylon,Dram,Damien Chazelle,1/20/2023,"43,620","3,888,207",Marc Platt (III),"Margot Robbie, Brad Pitt, Diego Calva",7.3,5,ABD
BTS: Yet to Come in Cinemas,BTS: Yet to Come in Cinemas,"Belgesel, Konser, Müzik",Oh Yoon-Dong,2/1/2023,"42,162","3,251,349"," CJ 4DPLEX, Trafalgar Releasing, Hybe Corporation",BTC,8.5,1,Güney Kore
Ammar 3: Cin Kabilesi,,Korku,Ahmet Yaşar Gümüş,1/13/2023,"29,499","1,807,113",B7 Medya Prodüksiyon,"Naz Gedik, İzzet Çivril, Reyhan İlhan",2.1,6,Türkiye
Winnie the Pooh: Kan ve Bal,Winnie the Pooh: Blood and Honey,Korku,Rhys Frake-Waterfield,2/17/2023,"20,885","1,570,454","Rhys Waterfield, Rhys Frake, Scott Jeffrey","Gillian Broderick, Paula Coiz, Chris Cordell",4.2,1,Birleşik Krallık
Uçak,Plane,"Gerilim, Aksiyon",Jean-François Richet,1/27/2023,"17,395","1,398,571","Gerard Butler, Marc Butan, Lorenzo di Bonaventura,","Gerard Butler, Mike Colter, Yoson An",6.5,4,"ABD, Birleşik Krallık"
Asteriks ve Oburiks: Orta Krallık,"Astérix & Obélix: L'Empire du Milieu, Asterix & Obelix: The Middle Kingdom","Macera, Komedi, Aile",Guillaume Canet,2/17/2023,"16,399","1,192,137",Alain Attal,"Guillaume Canet, Gilles Lellouche, Marion Cotillard",4.6,1,Fransa
Süper Yetenek 3: Büyük Yarış,Rock Dog 3: Battle the Beat,"Macera, Komedi, Animasyon",Anthony Bell,1/20/2023,"15,670","1,008,080","Mike Bujniewicz , Ralph Kamp","Jason Simpson (II), Donny Lucas, Cathy Weseluck",6.5,5,"ABD, Çin"
Balina,The Whale,Dram,Darren Aronofsky,2/10/2023,"15,398","1,400,991","Darren Aronofsky, Jeremy Dawson, Ari Handel","Brendan Fraser, Sadie Sink, Hong Chau",8.0,2,ABD
Kulübeye Tıklat,Knock At The Cabin,Gerilim,M.Night Shyamalan,2/3/2023,"14,997","1,228,881","M. Night Shyamalan, Ashwin Rajan, Marc Bienstock","Dave Bautista, Jonathan Groff, Rupert Grint",6.4,3,ABD
Tamiri Mümkün,,"Konser, Müzik",Recep Yılmaz,3/13/2023,"12,877","943,117",Mars Production,Mor ve Ötesi,8.5,3,Türkiye
The Banshees of Inisherin,,"Komedi, Dram",Martin McDonagh,2/3/2023,"12,315","1,143,798","Martin McDonagh, Graham Broadbent, Peter Czernin","Colin Farrell, Brendan Gleeson, Kerry Condon",7.8,3,"ABD, Birleşik Krallık, İrlanda"
Düşeş 1 - Mafya Sızıntısı,,Komedi,Bilal Kalyoncu,1/6/2023,"11,237","668,582",2506,"Hayrettin, Korhan Herduran, Ufuk Özkan",2.2,2,Türkiye
Pinokyo: Sihirli Yolculuk,Pinokkio. Pravdivaya istoriya,"Animasyon, Aile",Vasiliy Rovenskiy,2/10/2023,"8,657","585,244","Roman Borisevich, Maxim Rogalsky, Vasiliy Rovenskiy.","Jon Heder, Tom Kenny, Pauly Shore",3.6,2,"Macaristan, Rusya"
Fabelmanlar,The Fabelmans,Dram,Steven Spielberg,1/6/2023,"7,625","633,839","Steven Spielberg, Tony Kushner, Kristie Macosko Krieger","Michelle Williams, Paul Dano, Seth Rogen",7.6,4,ABD
Evlad-ı Cin,,Korku,Suat Ergin,1/6/2023,"6,385","349,814",Himer Reklam,"Berna Gülen, Serhat Şentürk, Yavuz Gürbüz",2.6,3,Türkiye
Korsaj,Corsage,"Dram, Tarihi, Biyografi",Marie Kreutzer,1/20/2023,"3,869","233,479","Alexander Glehr, Johanna Scherz","Vicky Krieps, Colin Morgan, Florian Teichtmeister",6.7,5,"Almanya, Avusturya, Fransa, Lüksemburg"
Aİ,EO,Dram,Jerzy Skolimowski,1/13/2023,"3,308","209,257","Jerzy Skolimowski, Ewa Piaskowska","Sandra Drzymalska, Isabelle Huppert, Lorenzo Zurzolo",6.8,5,"İtalya, Polonya"
Maskeli Balo,Mascarade,"Komedi, Dram, Suç",Nicolas Bedos,1/27/2023,"2,150","137,763","François Kraus, Denis Pineau-Valencienne, Sylvain Monod","Pierre Niney, Isabelle Adjani, François Cluzet",6.8,3,Fransa
Metronom,,Dram,Alexandru Belc,1/6/2023,"1,952","105,778","Emmanuel Quillet, Martine Vidalenc, Cătălin Mitulescu","Mara Bugarin, Serban Lazarovici, Vlad Ivanov",6.7,3,"Fransa, Romanya"
Cennetten Gelen Çocuk,"Walad Min Al Janna, Boy From Heaven","Gerilim, Dram",Tarik Saleh,2/3/2023,"1,935","120,929","Kristina Åberg, Fredrik Zander","Tawfeek Barhom, Fares Fares, Mohammad Bakri",7.2,3,"Danimarka, Finlandiya, Fransa, İsveç"
Uçsuz Bucaksız,L'Immensita,Dram,Emanuele Crialese,2/17/2023,963,"69,006","Dimitri Rassam, Mario Gianani, Lorenzo Gangarossa","Penélope Cruz, Vincenzo Amato, Alvia Reale",6.3,1,"Fransa, İtalya"
İfrit-i Cin,,Korku,Ertuğrul Yüreklikul,1/27/2023,"1,334","86,532",Makinist Film,"Burak Ergün, Canan Çalışkan, Ertuğrul Yüreklikul",2.2,1,Türkiye
Şeker Kız ve Arkadaşları Macera Adasında,Tarsilinha,"Macera, Komedi, Animasyon","Kiko Mistrorigo, Celia Catunda",12/30/2022,"1,898","103,937",Ricardo Rozzino,"Özge Çeçen, Ahmet Tekeş, Burçin Artut",7.8,3,Brezilya
Orman,,Korku,Mohsen Rabiei,12/30/2022,"1,869","101,575",Sos Medya,"Beyza Nur Önispir, Selda Yeliz Nar, Gizem Çelebi",7.1,3,Türkiye
Dikkat Köpek Var,,"Komedi, Aile","Ece İşbilen Dağ, Deniz Cem Dağ",12/30/2022,"2,769","155,443",Nussi Production,"Nusret Toplar, Mutlu Güney, Güney Kılınç",6.7,1,Türkiye
Ali Çevlik,,Dram,Mahmut Baldemir,12/30/2022,"9,387","281,714",Beyrut Yapım,"Erkan Bektaş, Sefa Zengin, Şevki Altunbuken",5.0,5,Türkiye
Hayalimdeki Düğün,Shotgun Wedding,"Komedi, Aşk, Aksiyon",Jason Moore,12/30/2022,"17,084","1,327,834","Jennifer Lopez, Todd Lieberman","Jennifer Lopez, Josh Duhamel, Lenny Kravitz",5.4,2,ABD
Lanetli Göl,Monstrous,"Korku, Gerilim, Gizem",Chris Sivertson,12/30/2022,"30,721","1,973,766","Robert Yocum, B.I. Rosen, Johnny Remo, Sasha Yelaun","Christina Ricci, Santino Barnard, Don Durrell",4.6,4,ABD
Çakallarla Dans 6,,"Komedi, Aksiyon",Murat Şeker,12/2/2022,"
862.380","50,504,213","SugarWorkz, TAFF","Şevket Çoruh, İlker Ayrık, Timur Acar",6.9,10,Türkiye
Bergen,,"Dram, Biyografi","Mehmet Binay, M. Caner Alper",3/4/2022,"5,484,798","160,057,802",Orchestra Content,"Farah Zeynep Abdullah, Erdal Beşikçioğlu, Tilbe Saran",6.9,28,Türkiye
Kesişme - İyi ki Varsın Eren,,"Dram, Biyografi",Özer Feyzioğlu,1/1/2022,"2,328,090","53,335,686","Dijital Sanatlar, TRT","İsmail Hacıoğlu, Rahman Beşel, Alayça Öztürk Gidişoğlu",7.3,43,Türkiye
Doktor Strange Çoklu Evren Çılgınlığında,Doctor Strange in the Multiverse of Madness,"Macera, Fantastik, Aksiyon, 3 Boyutlu, IMAX",Sam Raimi,5/6/2022,"1,563,041","59,457,089",Marvel Studios,"Benedict Cumberbatch, Elizabeth Olsen, Rachel McAdams",6.9,17,ABD
Avatar: Suyun Yolu,"Avatar: The Way of Water
","Macera, Fantastik, Aksiyon, 3 Boyutlu, IMAX",James Cameron,12/16/2022,"2,608,695","182,608,911",James Cameron,"Sam Worthington, Zoe Saldana, Sigourney Weaver",7.8,8,ABD
Thor: Aşk ve Gök Gürültüsü,Thor: Love and Thunder,"Macera, Fantastik, Aksiyon",Taika Waititi,7/8/2022,"1,229,668","53,833,184",Kevin Feige,"Chris Hemsworth, Tessa Thompson, Natalie Portman",6.3,15,ABD
Minyonlar 2: Gru'nun Yükselişi,Minions: The Rise of Gru,"Macera, Animasyon, 3 Boyutlu","Kyle Balda, Brad Ableson",7/1/2022,"1,194,447","49,750,622","Chris Renaud, Chris Meledandri, Janet Healy","Steve Carell, Alan Arkin, Taraji P. Henson",6.6,26,ABD
Aslan Hürkuş Kayıp Elmas,,Animasyon,"Hakan Bol, H. Sinan Güngor",1/7/2022,"1,167,455","27,460,718","Outline Ajans, Akko Organizasyon","Kayra Özdemir, Elif Gizem Aykul, Nusret Çetinel",6.3,28,Türkiye
The Batman,The Batman,"Dram, Suç, Aksiyon, IMAX",Matt Reeves,3/4/2022,"1,081,473","36,684,759"," Matt Reeves, Dylan Clark","Robert Pattinson, Zoë Kravitz, Paul Dano",7.8,10,ABD
Aslan Hürkuş Görevimiz Gökbey,,Animasyon,"H. Sinan Güngor, Semih Turalı, Yunus Emre Çakır",9/21/2022,"905,431","44,005,073",Outline Animation and Games,"Kayra Özdemir, Elif Gizem Aykul, Fatih Özkul",5.4,16,Türkiye
Kirpi Sonic 2,Sonic the Hedgehog 2,"Macera, Komedi, Aksiyon",Jeff Fowler,4/8/2022,"686,557","22,672,384","Sonic Team, Sega Technical Instute","Jim Carrey, James Marsden, Tika Sumpter",6.5,21,ABD
Dilberay,,"Dram, Biyografi",Ketche,2/4/2022,"686,495","18,555,172",Aytaç Medya,"Büşra Pekin, Ayberk Pekcan, Nursel Köse",5.9,18,Türkiye
Black Adam,,"Bilim-Kurgu, Aksiyon, IMAX",Jaume Collet-Serra,9/21/2022,"527,329","30,276,257","Dwayne Johnson, Dany Garcia, Hiram Garcia, Beau Flynn","Dwayne Johnson, Sarah Shahi, Pierce Brosnan",6.4,9,ABD
Tay,,Animasyon,Nurullah Yenihan,9/23/2022,"516,275","22,461,969",Laciverd,,5.0,19,Türkiye
Kırmızı,Turning Red,"Animasyon, 3 Boyutlu",Domee Shi,3/11/2022,"503,475","15,364,014",Lindsey Collins,"Rosalie Chiang, Sandra Oh, Ava Morse",7.0,18,ABD
Top Gun: Maverick,,"Dram, Aksiyon",Joseph Kosinski,5/27/2022,"498,395","21,624,164","Tom Cruise, Jerry Bruckheimer, Christopher McQuarrie, David Ellison","Tom Cruise, Val Kilmer, Jennifer Connelly",8.3,20,ABD
Black Panther: Yaşasın Wakanda,Black Panther: Wakanda Forever,"Macera, Aksiyon",Ryan Coogler,11/11/2022,"487,382","30,846,700","Kevin Feige, Nate Moore","Letitia Wright, Lupita Nyong'o, Angela Bassett",6.8,7,ABD
Jurassic World: Hâkimiyet,Jurassic World Dominion,"Macera, Bilim-Kurgu, Aksiyon",Colin Trevorrow,6/10/2022,"483,842","18,821,005","Universal Stüdyoları, Amblin Entertainment, Perfect World Pictures, Latina Pictures","Chris Pratt, Bryce Dallas Howard, Laura Dern",5.6,14,ABD
Uncharted,,"Macera, Aksiyon",Ruben Fleischer,2/11/2022,"447,171","13,953,139","Avi Arad, Alex Gartner, Charles Roven, Ari Arad","Tom Holland, Mark Wahlberg, Antonio Banderas",6.3,8,ABD
Fantastik Canavarlar: Dumbledore'un Sırları,Fantastic Beasts: The Secrets of Dumbledore,"Macera, Aile, Fantastik, IMAX",David Yates,4/15/2022,"434,214","16,891,691","David Heyman, J.K. Rowling, Steve Kloves, Lionel Wigram, Tim Lewis","Eddie Redmayne, Jude Law, Katherine Waterston",6.2,9,ABD
Müjdemi İsterim,,Komedi,Ömer Faruk Yardımcı,11/18/2022,"439,991","24,540,616",TMC Film,"Ahmet Kural, Ecem Erkek, Mehmet Özgür",5.4,9,Türkiye
Adanış Kutsal Kavga,,"Dram, Aksiyon",Emir Khalilzadeh,3/11/2022,"410,346","8,494,546",FFP Media,"İsmail Filiz, Esra Bilgiç, Baki İlhan",5.1,17,Türkiye
Kaptan Pengu ve Arkadaşları 2,,Animasyon,"Nurullah Yenihan, Pelin Tuğçe Şen",1/28/2022,"390,773","9,631,773",Siyah Martı,"Şensel Uykal, Onur Akgülgil, Emin Yaraç, Ufuk Yüksel, Ali İhsan Bozdemir",6.6,32,Türkiye
"Barış Akarsu ""Merhaba""",,"Dram, Biyografi",Mert Dikmen,11/18/2022,"367,006","19,775,689","Fikri Harika Prodüksiyon, Aytaç Medya","İsmail Ege Şaşmaz, Almila Ada, Hüseyin Avni Danyal",6.3,7,Türkiye
Benden Ne Olur?,,Romantik-Komedi,Murat Şenöy,1/14/2022,"360,863","9,481,634","Med Yapım, CJ ENM, Ay Yapım","Hazal Kaya, Onur Tuna, Enis Arıkan",4.7,10,Türkiye
Şarkını Söyle 2,Sing 2,"Komedi, Animasyon, 3 Boyutlu",Garth Jennings,1/21/2022,"338,972","8,916,573",Chris Meledandri; Janet Healy,"Arda Aydın, Figen Sumeli,Ali Çorapçı",7.4,9,ABD
Doru Macera Ormanı,,Animasyon,Arkın Aktaç,4/1/2022,"319,467","8,410,665",Anibera,"Dilek Gürel, Özgür Varul, Emin Yaraç",4.2,18,Türkiye
Müstakbel Damat,,Komedi,İlker Ayrık,11/11/2022,"308,886","16,055,486",Pervasız Yapım,"İlker Ayrık, Erdal Özyağcılar, Hande Soral",4.9,8,Türkiye
Nasreddin Hoca Zaman Yolcusu,,Animasyon,Nurullah Yenihan,12/9/2022,"362,677","19,057,674",Siyah Martı,"Ekinsu Karaata, Fatih Özkul, Ender Yiğit",4.1,9,Türkiye
Suikast Treni,Bullet Train,"Gerilim, Aksiyon",David Leitch,8/5/2022,"275,444","14,410,446","David Leitch, Antoine Fuqua, Kelly McCormick","Brad Pitt, Zazie Beetz, Aaron Taylor-Johnson",7.3,10,ABD
Karlar Kraliçesi ve Prenses,The Snow Queen & The Princess,Animasyon,"Andrey Korenkov, Aleksey Tsitsilin",11/11/2022,"251,137","13,460,658",Walt Disney Animation Studios,"Paul Rudd, Evangeline Lilly",6.2,8,Rusya
Kim Bu Aile?,,"Komedi, Aile, Aksiyon",Bedran Güzel,10/7/2022,"213,535","11,341,204",CJ ENM,"Cengiz Bozkurt, Nurgül Yeşilçay, Onur Buldu",5.5,6,Türkiye
Morbius,Morbius,"Macera, Dram, Aksiyon, 3 Boyutlu",Daniel Espinosa,4/1/2022,"208,718","7,061,615","Avi Arad, Lucas Foster, Matthew Tolmach","Jared Leto, Jared Harris, Matt Smith",5.2,5,ABD
Kurak Günler,,Dram,Emin Alper,12/9/2022,"248,148","16,544,461","Ay Yapım, Liman Film","Selahattin Paşalı, Ekin Koç, Erol Babaoğlu",8.1,11,Türkiye
Malazgirt 1071,,"Tarihi, Savaş, Aksiyon","Özgür Bakar, Bilal Kalyoncu",2/11/2022,"197,175","3,465,631",2506,"Cengiz Coşkun, Haluk Piyes, Caner Kurtaran",3.7,19,Türkiye
Çığlık,Scream,"Korku, Gerilim, Gizem","Tyler Gillett, Matt Bettinelli-Olpin",1/14/2022,"193,785","5,317,847","Cathy Konrad, Cary Woods","Neve Campbell, Courtney Cox, Jenna Ortega",6.3,7,ABD
Buğday Tanesi,,Dram,Doğan Ümit Karaca,12/2/2022,"233,125","7,011,590",Beyrut Yapım,"Kutsi, Yeliz Akkaya, Deniz Arna",5.0,9,Türkiye
Kim Demiş Kötüyüz Diye?,The Bad Guys,"Animasyon, 3 Boyutlu",Pierre Perifel,4/29/2022,"183,709","6,259,451",DreamWorks Animation,"Sam Rockwell, Marc Maron, Awkwafina",6.8,11,ABD
DC Süper Evciller Takımı,DC League of Super-Pets,"Macera, Animasyon, Fantastik","Sam Levine, Jared Stern",7/29/2022,"179,278","7,588,542","Patricia Hicks, Jared Stern, Dwayne Johnson","Dwayne Johnson, Kevin Hart, Kate McKinnon",7.2,15,ABD
Moonfall,,"Macera, Fantastik, Aksiyon, IMAX",Roland Emmerich,2/4/2022,"162,340","4,709,991","Roland Emmerich, Harald Kloser","Halle Berry, Patrick Wilson, John Bradley",5.1,8,"ABD, Çin, Kanada"
Yunus Çocuk,Dolphin Boy,"Animasyon, Aile",Mohammed Kheirandish,12/2/2022,"168,214","9,021,367","Mohammed Hamedani, Hüseyin Kuyulu, Hossein Raghebi","Burak Sergen, Esra Bilgiç, Yetkin Dikinciler",5.3,11,İran
Mutlu Oyuncak Dükkanı,,Animasyon,H. Sinan Güngor,6/10/2022,"155,510","5,280,376",Outline Animation and Games,"Elif Gizem Aykul, Hakan Coşar, Elifcan Kamiloğlu",5.9,16,Türkiye
Afacanlar: İş Başa Düştü,,"Komedi, Aile",Enes Ateş,2/4/2022,"149,747","4,195,141",CM Medya,"Berat Efe Parlar, Gürgen Öz, Burak Hakkı",4.5,25,Türkiye
Bandırma Füze Kulübü,,Dram,Ömer Faruk Sorak,10/21/2022,"148,275","7,042,026",İstanbul Sinemacılık,"Alina Boz, Deniz Can Aktaş, Erkan Kolçak Köstendil",7.2,16,Türkiye
Anka,,"Dram, Aksiyon",Süleyman Mert Özdemir,1/28/2022,"131,350","2,181,897",MGX Film,"Ozan Akbaba, Uğur Uzunel, Deniz Işın",4.6,4,Türkiye
Mahlûkat,,Korku,Alper Mestçi,2/18/2022,"128,679","3,473,984","Metronom Yapım, Aytaç Medya, Fikri Harika Prodüksiyon","Adnan Koç, Seda Oğuz, Kurtuluş Şakirağaoğlu",4.8,6,Türkiye
Sevmedim Deme,,"Dram, Biyografi",Burak Kuka,10/14/2022,"124,486","6,045,000","NETD, DMC, Mahzen Media","Kurtuluş Kuş, Burak Bulut, Ceyda Ateş",7.5,8,Türkiye
Hazine Avcısının Maceraları ve Zümrüt Tablet,Tad The Lost Explorer And The Emerald Tablet,Animasyon,Enrique Gato,9/2/2022,"122,648","5,817,800","Telecinco Cinema, Ikiru Films, Lightbox Animation Studios","Oscar Barberán, Luis Posada, Michelle Jenner",6.0,10,İspanya
Aya Sihirli Yolculuk,Moonbound,"Macera, Animasyon, Aile",Ali Samadi Ahadi,10/28/2022,"119,435","6,362,983","Ali Samadi Ahadi, Frank Geiger, Armin Hofmann","Dirk Petrick, Peter Simonischek, Roxana Samadi",4.8,13,"Almanya, Avusturya"
Hep Yek 5: Bizim Şeyimiz mi Altan,,Komedi,Özgür Bakar,11/4/2022,"113,008","5,946,819","2506, TME Films","İnan Ulaş Torun, Önder Açıkbaş, Tuna Orhan",3.3,7,Türkiye
Gülümse,Smile,Korku,Parker Finn,9/30/2022,"100,755","5,570,191"," Paramount Players, Temple Hill Entertainment","Sosie Bacon, Kyle Gallner, Caitlin Stasey",6.6,8,ABD
Mutlu Canavar Ailesi 2,"Monster Family 2, Happy Family 2","Macera, Komedi, Animasyon",Holger Tappe,2/25/2022,"98,956","2,851,366","Holger Tappe, Stefan Mischke, Michael Mack","Emily Watson, Nick Frost, Jessica Brown Findlay",4.8,18,"Almanya, Birleşik Krallık"
Zebun,,Korku,"Mesut Erbaş, Hakan Yusufoğulları",4/29/2022,"90,099","2,930,424","Zer Film, HM Productions","Hakan Akgün, Sema Şimşek, Almina Kahraman",2.9,9,Türkiye
Kendinden Kaçak,,Komedi,Levent Türkan,4/8/2022,"85,935","2,412,948",Blackwhite Film Prodüksiyon,"Atakan Özyurt, Bilal Hancı, Fatih Yasin",2.4,5,Türkiye
Orman Vatandır - Çanakkale Ruhu,,Belgesel,"Mehmet Balaban, Mehmet Ali Sevimli",3/18/2022,"82,481","1,271,946",Erka Medya,"Murat Tavlı, Ferit Kılıç, Harun Kocatürk",6.2,7,Türkiye
Masal Şatosu: Gizemli Misafir,,"Aile, Fantastik",Burak Kuka,8/12/2022,"78,830","3,251,292","RETROPRO, NETD, DMC, WOVIE","Ecrin Su Çoban, Gülse Göçer, Ozan Varol",6.1,13,Türkiye
Siyah Telefon,The Black Phone,Korku,Scott Derrickson,6/24/2022,"76,110","3,056,525","Jason Blum, Scott Derrickson","Ethan Hawke, Mason Thames, Madeleine McGraw",6.9,10,ABD
Hopper ve Çılgın Çetesi: Büyük Macera,"Hopper et le hamster des ténèbres, Chickenhare and the Hamster of Darkness","Macera, Komedi, Animasyon","Ben Stassen, Benjamin Mousquet",5/27/2022,"74,516","2,456,284","Ben Stassen, Caroline Van Iseghem, Matthieu Zeller","Thomas Solivérès, Chloé Jouannet, Nicolas Maury",6.3,21,"Belçika, Fransa"
Sil Baştan Kaynanam,,Komedi,Raşit Çelikezer,12/9/2022,"77,505","2,990,897",Greenart Group,"Alper Saldıran, Algı Eke, Zeynep Eronat",3.2,10,Türkiye
Cesur İtfaiyeci,Fireheart,"Macera, Komedi, Animasyon","Theodore Ty, Laurent Zeitoun",4/22/2022,"68,826","2,219,314"," Laurent Zeitoun, Yann Zenou, Valérie d'Auteuil","Alice Pol, Vincent Cassel, Valérie Lemercier",6.2,17,"Fransa, Kanada"
Zir-i Cin,,"Korku, Gerilim",Emre Pala,7/1/2022,"68,201","2,516,281",HM Productions,"Defne Çoban, Ogan Şenyolcu, Mohamad Ahmad",4.5,6,Türkiye
Ejderham ve Ben,Dragon Rider,"Macera, Animasyon, Aile, 3 Boyutlu",Tomer Eshed,5/13/2022,"68,200","2,251,883","Oliver Berben, Christoph Müller, Martin Moszkowicz","Thomas Brodie-Sangster, Felicity Jones, Freddie Highmore",5.7,11,Almanya
Jujutsu Kaisen 0: The Movie,,"Animasyon, Fantastik, Aksiyon",Seong-Hu Park,5/13/2022,"65,710","2,479,597","Gege Akutami, Chinatsu Akasaki, Toshihiro Maeda","Megumi Ogata, Kana Hanazawa, Mikako Komatsu",7.8,6,Japonya
Efsane Takım: Bilim Kahramanları,,Animasyon,Suat Emuce,10/7/2022,"63,788","2,214,635",Dukka Medya,"Aydoğan Temel, Ercan Demirel, Fatih Özkul",7.2,14,Türkiye
Tamirhane,,Komedi,Erkan Kolçak Köstendil,11/11/2022,"60,158","3,442,775",Sky Films,"Nejat İşler, Rıza Kocaoğlu, Merve Dizdar",5.7,6,Türkiye
Neşeli Kanatlar: Büyük Göç,Duck Duck Goose,Animasyon,Christopher Jenkins,3/18/2022,"59,831","1,590,933","Sandra Rabins, Penney Finkelman Cox, Harley Zhao","Jim Gaffigan, Zendaya, Lance Lim",5.7,20,"ABD, Birleşik Krallık, Çin"
Olmadı Kaçarız,,Komedi,Erkan Nurhan,2/18/2022,"58,359","1,389,323",Medyacızade,"Aykut Elmas, Halil İbrahim Göker, Ezgi Gizem",6.6,2,Türkiye
Elvis,,"Dram, Biyografi, Müzik",Baz Luhrmann,6/24/2022,"58,252","2,914,834","Baz Luhrmann, Catherine Martin, Gail Berman","Austin Butler, Tom Hanks, Olivia DeJonge",7.3,15,ABD
Asi Prenses,"Pil, Pil's Adventures","Macera, Animasyon, Fantastik",Julien Fournet,6/17/2022,"56,978","2,125,214","Jean-François Tosti, David Alaux, Éric Tosti","Kaycie Chase, Paul Borne, Julien Crampon",6.1,16,Fransa
The King's Man: Başlangıç,The King's Man,"Macera, Komedi, Aksiyon",Matthew Vaughn,1/7/2022,"56,639","1,672,259"," Matthew Vaughn, David Reid, Adam Bohlin","Ralph Fiennes, Harris Dickinson, Djimon Hounsou",6.3,5,"ABD, Birleşik Krallık"
Kayıp Şehir,The Lost City,"Romantik-Komedi, Aksiyon","Aaron Nee, Adam Nee",3/25/2022,"56,334","1,896,687","Sandra Bullock, Seth Gordon, Liza Chasin","Sandra Bullock, Channing Tatum, Daniel Radcliffe",6.1,4,ABD
Ayı Kardeşler: Macera Parkı,"Xiong Chu Mo: Kuang Ye Da Lu, Boonie Bears: The Wild Life",Animasyon,Leon Ding,1/28/2022,"56,195","1,343,956",Leon Ding,"Chris Boike, Joseph S. Lambert, Siobhan Lumsden",4.5,23,Çin
Mahalleden Arkadaşlar,,Komedi,Selçuk Aydemir,11/4/2022,"54,731","2,839,118",TR 40 33 Productions,"Nurgül Yeşilçay, Alper Kul, Murat Akkoyunlu",3.2,9,Türkiye
Cennete Bilet,Ticket to Paradise,Romantik-Komedi,Ol Parker,9/16/2022,"53,835","3,418,789"," Deborah Balderstone, Tim Bevan, Sarah Harvey","Julia Roberts, George Clooney, Kaitlyn Dever",6.2,10,ABD
The Menu,,"Korku, Komedi",Mark Mylod,11/18/2022,"54,536","4,333,286","Adam McKay, Will Ferrell, Betsy Koch","Anya Taylor-Joy, Ralph Fiennes, Nicholas Hoult",7.2,9,ABD
Kurtuluş Hattı,,"Dram, Tarihi, Savaş",Selman Kayabaşı,5/13/2022,"52,442","994,139",Yakın Plan,"Hamdi Erdoğan, Gülsim Ali, Yusuf Aytekin",6.1,6,Türkiye
İlk Seans: NMSM,,"Korku, Gerilim",Gökhan Murat Toktamışoğlu,3/11/2022,"52,098","1,486,319",Hann Yapım,Eylül Ezgi Yılmaz,2.1,2,Türkiye
Karlar Kralı Norm 2,,Animasyon,"Richard Finn, Tim Maltby",1/14/2022,"51,953","1,212,357","Andrew Tight, Ken Katsumoto, Liz Young","Fatih Özacun, Uğur Taşdemir, Ali Çorapçı",3.4,19,"ABD, Çin, Güney Kore, Hindistan"
Kuzeyli,The Northman,"Macera, Dram, Aksiyon",Robert Eggers,4/22/2022,"51,920","2,055,860","Alexander Skarsgård, Robert Eggers, Lars Knudsen","Alexander Skarsgård, Anya Taylor-Joy, Claes Bang",7.1,7,ABD
Hazine,,"Macera, Komedi, Aksiyon",Canbert Yerguz,11/4/2022,"49,826","2,748,878",BKM,"Çağlar Çorumlu, Boran Kuzum, Şükran Ovalı",6.2,4,Türkiye
"Tim, Tim, Timsah","Lyle, Lyle, Crocodile","Macera, Animasyon","Josh Gordon, Will Speck",11/18/2022,"48,436","2,896,663","Will Speck, Josh Gordon, Hutch Parker","Javier Bardem, Constance Wu, Winslow Fegley",6.1,8,ABD
Düşler Fabrikası,"Drømmebyggerne, Dreambuilders","Macera, Komedi, Animasyon","Kim Hagen Jensen, Tonni Zinck",4/8/2022,"47,231","1,464,221","Nynne Selin, Sunit Parekh","Emilie Koppel, Alberte Winding, Rasmus Botoft",6.0,12,Danimarka
Amsterdam,,"Dram, Tarihi",David O. Russell,10/7/2022,"46,503","3,067,218"," Christian Bale, David O. Russell, Matthew Budman","Christian Bale, Margot Robbie, John David Washington",6.1,5,ABD
Niloya,,Animasyon,Arkın Aktaç,11/11/2022,"46,208","2,315,673",Anibera,"Berrak Nehir KÖK, Berk Pamir, Zeynep Önen",3.2,7,Türkiye
Tam Kafadan Karavana,,Komedi,"Oğuz Öztürk, Celal Öztürk",4/29/2022,"44,267","1,395,983","Bros Film, Lokum Games","Ali Biçim, Mesut Can Tomay, Efekan Can",4.8,5,Türkiye
Nil'de Ölüm,Death on the Nile,"Gerilim, Dram, Suç",Kenneth Branagh,2/11/2022,"43,585","1,487,199","Kenneth Branagh, Ridley Scott, Judy Hofflund","Kenneth Branagh, Gal Gadot, Emma Mackey",6.3,5,ABD
Dert Etme Sevgilim,Don't Worry Darling,"Korku, Gerilim",Olivia Wilde,9/23/2022,"43,269","2,559,041","Olivia Wilde, Katie Silberman, Roy Lee","Florence Pugh, Harry Styles, Olivia Wilde",6.2,4,ABD
Ambulans,Ambulance,"Gerilim, Dram, Aksiyon",Michael Bay,3/18/2022,"42,560","1,385,973","Michael Bay, James Vanderbilt, Brad Fischer","Jake Gyllenhaal, Yahya Abdul-Mateen II, Eiza González",6.1,4,ABD
Cadılar Bayramı Sona Eriyor,Halloween Ends,Korku,David Gordon Green,10/14/2022,"42,146","2,333,760","Jason Blum, Malek Akkad, Bill Block","Jamie Lee Curtis, Andi Matichak, Kyle Richards",5.0,4,ABD
Kocaayak ve Ailesi,Bigfoot Family,"Macera, Animasyon, Aile","Ben Stassen, Jeremy Degruson",3/25/2022,"42,459","1,209,677","Ben Stassen, Cal Brunker, Caroline Van Iseghem","Kylian Trouillard, Alexis Victor, Marieve Herington",5.8,18,"Belçika, Fransa"
Hayır,Nope,Korku,Jordan Peele,8/19/2022,"41,877","2,183,390","Jordan Peele, Ian Cooper","Daniel Kaluuya, Keke Palmer, Steven Yeun",6.9,6,ABD
"Masal Zamanı ""Melez Prenses""",,"Komedi, Aile, Fantastik","Kubilay Güleçoğlu, Burak Kahraman",1/21/2022,"40,555","953,119",Korsan Medya,"Lavinya Ünlüer, Kaan Yılmaz, Ebrar Demirbilek",7.8,3,Türkiye
