Film_Adi_TR,Film_Adi_Yabanci,Film_Turu,Yonetmen,Vizyon_Tarihi,Seyirci_Sayisi,Toplam_Hasilat,Yapimci,Oyuncular,IMDb,Gosterim_Hafta,Yapimci_Ulke
Barbie Prenses ve Rock Star,Barbie Rock'n Royals,Animasyon,Karen J. Lloyd,8/14/2015,"127,264","1,387,593",Universal,Farah Zeynep Abdullah,5.9,8,ABD
Pırdino Sürpriz Yumurta,,Aile,Günay Köker,11/20/2015,"131,488","1,463,607","Menassa Film, Siyah Martı","Arzu Yurtseven, Gökçer Genç, Efe Kılıç",3.5,24,Türkiye
Stajyer,The Intern,Komedi,Nancy Meyers,9/25/2015,"126,963","2,057,697",Warner Bros.,"Robert De Niro, Anne Hathaway, Nat Wolff",7.1,12,ABD
Whiplash,,"Dram, Müzik",Damien Chazelle,1/16/2015,"126,211","1,834,388",Couper Samuelson ,"Miles Teller, J.K. Simmons, Melissa Benoist",8.5,23,ABD
Karlar Kraliçesi 2,"Snezhnaya Koroleva 2, Snow Queen 2",Animasyon,Aleksey Tsitsilin,5/1/2015,"123,905","1,396,659","Timur Bekmambetov ,","Erkan Taşdöğen, Figen Aksoy",5.8,12,RUSYA
Bizim Hikaye,,"Dram, Aksiyon",Yasin Uslu,3/27/2015,"124,903","1,202,511",Alaaddin Film,"Cansel Elçin, Haluk Piyes, Sera Tokdemir",5.3,20,Türkiye
Ayı Teddy 2,Ted 2,Komedi,Seth MacFarlane,7/10/2015,"121,556","1,431,440",Universal,"Mark Wahlberg, Amanda Seyfried, Giovanni Ribisi",6.3,6,ABD
Asteriks: Roma Sitesi,"Astérix: Le Domaine des Dieux, Asterix The Land of the Gods","Animasyon, 3 Boyutlu","Louis Clichy, Alexandre Astier",2/27/2015,"120,895","1,439,282","Natalie Altmann , Thomas Valentin ,","Roger Carel , Alexandre Astier",6.9,15,FRANSA
Selfless,,Bilim-Kurgu,Tarsem Singh,7/10/2015,"118,223","1,439,261","Ram Bergman , Peter Schlessel , James D. Stern","Natalie Martinez, Victor Garber, Douglas M. Griffin",6.5,7,ABD
Pişt,,Komedi,Can Sarcan,5/29/2015,"116,017","917,694",Avşar Film,"Murat Serezli, Oğuzhan Uğur, Doğa Konakoğlu",2.1,14,Türkiye
Müzede Bir Gece: Lahitteki Sır,Night at the Museum: Secret of the Tomb,"Komedi, Aile, Aksiyon",Shawn Levy,1/2/2015,"115,632","1,392,252",20th Century Studios,"Robin Williams, Ben Stiller, Owen Wilson",6.2,13,"ABD, Birleşik Krallık"
Mihrez: Cin Padişahı,,"Korku, Gerilim",Doğa Can Anafarta,4/17/2015,"113,699","1,188,468",Chantier,"Müge Esmeray, Melisa Toros, Tarık Ündüz",3.1,7,Türkiye
Sebahat & Melahat,,Komedi,Kalender Hasan,4/17/2015,"108,110","1,158,352",Mint Prodüksiyon,"Sami Aksu, Seymen Aydın, Adem Yılmaz",2.4,8,Türkiye
En Güzeli,,Komedi,Mustafa Uğur Yağcıoğlu,8/28/2015,"107,663","1,095,374",Yayla Medya,"Tuvana Türkay, Fırat Çöloğlu, Erkan Can",3.5,6,Türkiye
Ruhlar Bölgesi Bölüm 3,Insidious: Chapter 3,Korku,Leigh Whannell,6/5/2015,"105,639","1,163,559",Sony Pictures,"Dermot Mulroney, Stefanie Scott, Lin Shaye",6.1,6,ABD
Şeytan-ı Racim 2: İfrit,,"Korku, Gerilim",Gökhan Murat Toktamışoğlu,6/5/2015,"105,600","1,004,582",Uğur Filmcilik,"Firuze Gamze Aksu, Derya Deniz Değirmenci, Emre Kılıç",2.4,11,Türkiye
Bana Adını Sor,,"Aşk, Dram",Taner Gündöner,3/13/2015,"103,962","1,020,689",Mahzens Film,"Özge Borak, Engin Hepileri, Başak Parlak",5.6,20,Türkiye
Kağıttan Kentler,Paper Towns,"Aşk, Dram",Jake Schreier,7/24/2015,"98,562","1,081,488",20th Century Studios,"Cara Delevingne, Nat Wolff, Halston Sage",6.2,9,ABD
Madımak: Carina'nın Günlüğü,,Dram,Ulaş Bahadır,9/25/2015,"98,044","1,144,321",Gökkuşağı Film,"Altan Erkekli, Füsun Demirel, Erdal Tosun",6.1,9,Türkiye
Mazlum Kuzey,,Komedi,Ali Adnan Özgür,1/16/2015,"93,326","939,357",Avşar Film,"Önder Açıkbaş, Bahtiyar Engin, Seçil Buket Akıncı",2.8,5,Türkiye
Azem 2: Cin Garezi,,"Korku, Gerilim",Erdinç Kazımoğlu,5/15/2015,"92,864","939,716",RETROPRO,"Murat Bülent Atacan, Ceren Gündoğdu, İzzet Lüleci",3.3,3,Türkiye
Takip 3,Taken 3,"Macera, Aksiyon",Olivier Megaton,1/9/2015,"91,814","1,167,089",20th Century Studios,"Liam Neeson, Maggie Grace, Forest Whitaker",6.0,6,ABD
Cin Kuyusu,,Korku,Gökhan Murat Toktamışoğlu,11/6/2015,"89,835","951,913",VTR,"Sinem Sarızayim, Zeynep Buse Kale, Beril Özgür",4.1,6,Türkiye
Robinson Crusoe ve Cuma,,Komedi,Gürcan Yurt,9/4/2015,"89,536","936,739",Film Bahçesi,"Serhat Kılıç, Jhon Nyambi, Beyti Engin",4.7,6,Türkiye
Her Şeyin Teorisi,The Theory of Everything,Dram,James Marsh,2/27/2015,"89,324","1,221,913",Universal,"Harry Lloyd, Simon McBurney, Eddie Redmayne",7.7,8,Birleşik Krallık
Keskin Nişancı,American Sniper,Dram,Clint Eastwood,2/20/2015,"88,289","1,128,207",Warner Bros.,"Sienna Miller, Bradley Cooper, Luke Grimes",7.3,5,ABD
Uzaklarda Arama,,"Komedi, Dram",Türkan Şoray,11/27/2015,"87,025","964,950",Vadi Film,"Sema Keçik, Turgay Aydın, Goncagül Sunar",5.0,6,Türkiye
Çılgın Dostlar 4: Korkak Kahraman,Open Season: Scared Silly,Animasyon,David Feiss,12/18/2015,"107,111","1,085,946",John Bush,"Will Townsend , Michelle Murdocca",5.0,24,ABD
Sevimli Ejderha: Kokonat 3D,"Der Kleine Drache Kokosnuss, Coconut: The Little Dragon","Animasyon, 3 Boyutlu","Hubert Weiland, Nina Wels",3/13/2015,"85,806","812,563",Gabriele Walther,Oya Küçümen,4.6,43,"Almanya, Avusturya"
Birdman veya (Cahilliğin Umulmayan Erdemi),"Birdman: Or, The Unexpected Virtue of Ignorance","Komedi, Dram",Alejandro Gonzalez Inarritu,2/27/2015,"79,884","1,087,686",20th Century Studios,"Amy Ryan, Andrea Riseborough, Michael Keaton",7.7,12,ABD
Kahraman Miçolar,Ooops! Noah is gone...,"Animasyon, 3 Boyutlu","Toby Genkel, Sean Mccormack",7/31/2015,"79,600","873,423"," Emely Christians, Moe Honan, Jan Goossen",Ziya Kürküt,5.8,9,"Almanya, Belçika, İrlanda, Lüksemburg"
Solace,,Gerilim,Afonso Poyart,10/23/2015,"77,927","1,092,518","Beau Flynn , Tripp Vinson , Matthias Emcke ,","Abbie Cornish, Colin Farrell, Anthony Hopkins",6.4,7,ABD
Limonata,,Komedi,Ali Atay,4/24/2015,"76,449","856,075",MNS Film,"Ertan Saban, Serkan Keskin, Funda Eryiğit",7.4,6,Türkiye
Lazarus Etkisi,The Lazarus Effect,"Korku, Gerilim",David Gelb,3/6/2015,"76,357","826,953"," Jason Blum , Jeanette Brill , Phillip Dawe","Mark Duplass, Olivia Wilde, Donald Glover",5.2,3,ABD
Cesur Tom ve Sihirli Ayna,"Menique y el Espejo Magico, Tom Little And The Magic Mirror",Animasyon,Ernesto Padrón,1/23/2015,"79,101","706,463"," Mamen Quintas, Esther Hirzel Galarza",Keremcem Dürük,4.7,42,"İspanya, Küba"
Öğrenci İşleri,,Komedi,Talip Karamahmutoğlu,4/24/2015,"73,146","717,496",Güzel İşler,"Murat Akkoyunlu, Fırat Tanış, Yeliz Şar Güleç",4.0,6,Türkiye
Fokus,Focus,Komedi,"Glenn Ficarra, John Requa",3/20/2015,"71,773","914,401",Warner Bros.,"Will Smith, Margot Robbie, Rodrigo Santoro",6.6,8,ABD
Piramitin Laneti,The Pyramid,"Korku, Gerilim",Grégory Levasseur,4/10/2015,"70,365","755,072",20th Century Studios,"Ashley Hinshaw, Denis O'Hare, James Buckley",4.6,3,ABD
Aşk Nerede?,,Romantik-Komedi,Semra Dündar,9/25/2015,"69,531","721,209",Kült Film,"Kadir Çöpdemir, Ayça Erturan, Faik Ergin",4.4,4,Türkiye
Son Şans,Southpaw,"Dram, Spor",Antoine Fuqua,8/7/2015,"64,009","790,113","Antoine Fuqua, Peter Riche, Todd Black, Steve Tisch","Jake Gyllenhaal, Rachel McAdams, Forest Whitaker",7.3,7,ABD
Hüddam,,"Korku, Gerilim",Utku Uçar,11/20/2015,"64,815","687,429",Hayal Sanat,"Murat Özen, Fatoş Hun, Çağrı Duran",4.2,23,Türkiye
Hayat Kitabı,Book of Life,"Animasyon, 3 Boyutlu",Jorge R. Gutierrez,6/5/2015,"63,226","691,477",20th Century Studios,"Channing Tatum, Zoe Saldana",7.2,12,ABD
Manda Yuvası,,Komedi,İlyas İlbey,2/27/2015,"61,548","614,547",Yaya Yapım,"Seray Sever, Kemal Kuruçay, İlyas İlbey",5.7,6,Türkiye
Kurbağa Krallığı,Frog Kingdom,Animasyon,"Nelson Shin, Melanie Simka",12/11/2015,"63,680","725,906","Liguo Zheng, Mychal Simka, Xiangfen Meng","Bella Thorne , Gregg Sulkin",3.4,10,ABD
Uyuyana Kadar,Before I Go to Sleep,Gerilim,Rowan Joffe,1/2/2015,"60,869","918,137"," Mark Gill , Avi Lerner , Liza Marshall","Colin Firth, Nicole Kidman, Mark Strong",6.3,6,"Birleşik Krallık, Fransa, İsveç"
Kurbağa Prens,Ribbit,"Animasyon, 3 Boyutlu",Chuck Powers,6/26/2015,"60,410","637,249"," Shireen M. Hashim ,",Ziya Kürküt,4.1,7,Malezya
Hayalet Dayı,,Komedi,Ali Yorgancıoğlu,5/29/2015,"60,099","614,860",DCC Film,"Settar Tanrıöğen, Ozan Özcan, Caner Özyurtlu",4.7,9,Türkiye
Polis Akademisi: Alaturka,,Komedi,Ali Yorgancıoğlu,4/17/2015,"59,946","600,165",Aydın Film,"Mehmet Ali Erbil, Peker Açıkalın, Yolanthe Cabau",2.1,3,Türkiye
Victor Frankenstein,,"Korku, Macera, Fantastik",Paul McGuigan,12/11/2015,"59,732","750,015",20th Century Studios,"Daniel Radcliffe, Charles Dance, James McAvoy",5.9,3,ABD
Üçkağıtçı Mortdecai,Mortdecai,"Komedi, Aksiyon",David Koepp,1/30/2015,"59,332","816,945","Christi Dembrowski , Johnny Depp , Andrew Lazar","Johnny Depp, Ewan McGregor, Gwyneth Paltrow",5.5,7,ABD
Tehlikeli Yürüyüş,The Walk,"Dram, Biyografi, 3 Boyutlu",Robert Zemeckis,10/9/2015,"55,944","896,826",Sony Pictures,"Ben Kingsley, Joseph Gordon-Levitt, Charlotte Le Bon",7.3,4,ABD
Kaçış Yok,No Escape,"Gerilim, Aksiyon",John Erick Dowdle,8/28/2015,"55,308","678,486"," Steve Alexander , Drew Dowdle , Chris Lowenstein","Owen Wilson, Pierce Brosnan, Lake Bell",6.7,4,ABD
Ölümsüz Aşk,The Age of Adaline,"Aşk, Dram",Lee Toland Krieger,6/5/2015,"53,842","684,061"," Sidney Kimmel , Gary Lucchesi , Alix Madigan","Blake Lively, Michiel Huisman, Harrison Ford",7.2,8,ABD
Maymun Prens,"Pourquoi J'ai pas Mange mon Pere, Monkey Prince","Animasyon, 3 Boyutlu",Jamel Debbouze,4/23/2015,"53,820","598,492",Fred Fougea,Jamel Debbouze,4.9,11,"Belçika, Çin, Fransa, İtalya"
Chappie,,"Bilim-Kurgu, Aksiyon",Neill Blomkamp,3/6/2015,"53,494","660,606",Sony Pictures,"Hugh Jackman, Sigourney Weaver, Sharlto Copley",6.8,3,ABD
Doraemon,Stand by Me Doraemon,"Animasyon, 3 Boyutlu","Tony Oliver, Ryuichi Yagi, Takashi Yamazaki",9/11/2015,"56,248","625,267",Shuji Abe,"Megumi Ōhara , Wasabi Mizuta",7.3,28,"ABD, Japonya"
Eski Sevgiliyi Unutmanın 10 Yolu,,Komedi,Biray Dalkıran,8/7/2015,"51,049","521,170",DFGS,"Atılgan Gümüş, Tuğçe Sarıkaya, Orçun Kaptan",2.7,5,Türkiye
Yolunda A.Ş. Çinçin Bağları Hikayesi,,"Komedi, Dram",Emre Budak,5/1/2015,"49,230","561,750",Han Yapım,"Emre Budak, Defne Yalnız, Erdağ Yenel",4.1,6,Türkiye
Pan,,"Aile, Fantastik, 3 Boyutlu",Joe Wright,12/11/2015,"49,364","627,749",Warner Bros.,"Hugh Jackman, Levi Miller, Rooney Mara",5.7,4,ABD
Ölümcül Takip,Survivor,"Gerilim, Aksiyon",James McTeigue,6/19/2015,"49,052","561,309"," Charles Winkler , Irwin Winkler ,","Pierce Brosnan, Milla Jovovich, Dylan McDermott",5.6,6,"ABD, Birleşik Krallık"
Ziyaret,The Visit,Gerilim,M.Night Shyamalan,9/11/2015,"48,243","586,662",Universal,"Kathryn Hahn, Olivia DeJonge, Ed Oxenbould",6.2,3,ABD
Merdiven Baba,,"Komedi, Dram",Hasan Tolga Pulat,8/14/2015,"47,533","465,723",Mint Prodüksiyon,"Hacı Ali Konuk, Esra Dermancıoğlu, Emin Gümüşkaya",5.2,4,Türkiye
Lanet 2,Sinister 2,Korku,Ciaran Foy,8/21/2015,"46,962","484,981",Scott Derrickson,"Shannyn Sossamon, James Ransone, Nicholas King",5.3,5,ABD
Kara Düzen,Black Mass,"Dram, Suç",Scott Cooper,10/16/2015,"46,199","682,212",Warner Bros.,"Johnny Depp, Joel Edgerton, Benedict Cumberbatch",6.9,8,ABD
Minik Kuş,"Gus - Petit oiseau, grand voyage, Yellow Bird","Animasyon, 3 Boyutlu",Christian De Vita,8/21/2015,"46,064","530,608",Corinne Kouper,"Arthur Dupont ,Sara Forestier",5.5,22,"Belçika, Fransa"
Frankenstein,,"Korku, Gerilim, Fantastik",Bernard Rose,10/29/2015,"44,487","504,229",Gabriela Bacher,"Carrie-Anne Moss, Danny Huston, Xavier Samuel",5.1,5,"ABD, Almanya"
Çok Pişmiş,Burnt,Komedi,John Wells,10/30/2015,"44,377","711,698",Michael Shamberg,"Omar Sy, Bradley Cooper, Daniel Brühl",6.6,11,ABD
İki Aşk Arasında,How to Make Love Like an Englishman,Romantik-Komedi,Tom Vaughan,7/24/2015,"44,064","556,174",Grant Cramer,"Salma Hayek, Pierce Brosnan, Jessica Alba",5.7,9,ABD
Olur İnşallah,,Komedi,Tolga Baş,6/5/2015,"43,348","408,724",Artist Film Yapım,"Çetin Altay, Sümer Tilmaç, Mehtap Bayri",3.6,5,Türkiye
Kaptan Cingöz Macera Peşinde,Albert,Animasyon,Karsten Kiilerich,1/19/2050,"54,807","492,951","Kim Magnusson , Tivi Magnusson","Alfred Bjerre Larsen , Oscar Dietz , Morten Eisner",4.7,46,Danimarka
Gizemli Gerçek,Secret in Their Eyes,"Gerilim, Aşk, Dram",Billy Ray,11/20/2015,"42,780","607,526",Mark Johnson,"Julia Roberts, Nicole Kidman, Chiwetel Ejiofor",6.3,6,ABD
Point Break,,Aksiyon,Ericson Core,12/25/2015,"57,335","820,526",Broderick Johnson,"Judah Lewis, Luke Bracey, Edgar Ramirez",5.3,6,ABD
Hacker,Blackhat,"Gerilim, Suç, Aksiyon",Michael Mann,1/16/2015,"41,860","547,145",Universal,"Chris Hemsworth, Ritchie Coster",5.4,3,ABD
Kızıl Tepe,Crimson Peak,Korku,Guillermo del Toro,10/16/2015,"40,650","555,519",Universal,"Burn Gorman, Doug Jones, Mia Wasikowska",6.5,4,ABD
Hannas: Karanlıkta Saklanan,,"Korku, Gerilim","Kamil Aydın, Oya Köksal",6/12/2015,"40,589","398,042",Varyant Prodüksiyon,"Hazal Şenel, Furkan Kızılay, Bükre Atala",4.6,5,Türkiye
Entourage,,Komedi,Doug Ellin,7/3/2015,"39,405","535,275",Warner Bros.,"Mark Wahlberg, Billy Bob Thornton, Jeremy Piven",6.5,6,ABD
Helak: Kayıp Köy,,"Korku, Gerilim",Özgür Bakar,5/22/2015,"38,709","395,187",Calion Film,"Fırat Tanış, Soydan Soydaş, Tuğçe Aksum",4.5,7,Türkiye
Seninle Bir Ömür,The Longest Ride,"Aşk, Dram",George Tillman Jr.,5/29/2015,"38,647","424,638",20th Century Studios,"Britt Robertson, Scott Eastwood, Alan Alda",7.0,10,ABD
Macbeth,,"Dram, Tarihi",Justin Kurzel,12/4/2015,"39,284","591,847","Iain Canning , Emile Sherman","Michael Fassbender, Marion Cotillard, Paddy Considine",6.6,7,"ABD, Birleşik Krallık, Fransa"
Azap,,"Korku, Gerilim","Dilek Keser, Ulaş Güneş Kaçargil",12/11/2015,"38,983","376,810",Donkişot Film,"İrem Deniz, Ayşe Selen, Dilşah Demir",4.8,11,Türkiye
Adana İşi,,Komedi,Ali Adnan Özgür,9/24/2015,"40,422","461,142",Calion Film,"Ezel Akay, Füsun Demirel, Murat Akkoyunlu",3.1,6,Türkiye
Hayatın Kıyısında,By the Sea,"Aşk, Dram",Angelina Jolie,11/20/2015,"36,685","494,351",Universal,"Brad Pitt, Angelina Jolie, Melanie Laurent",5.3,4,ABD
My Little Pony: Arkadaşlık Oyunları,My Little Pony: Equestria Girls - Friendship Games,Animasyon,"Ishi Rudell, Jayson Thiessen",10/16/2015,"38,742","427,878","Brian Goldner , Stephen Davis"," Tara Strong, Ashleigh Ball, Andrea Libman",6.4,19,ABD
Ezan,,"Korku, Gerilim",Fuat Yılmaz,5/1/2015,"36,145","347,395","BYFY Productions, MC Film","Osman B. Keser, Yeliz Yeşil, Şahin Özden",2.9,5,Türkiye
Altın Gol,Metegol,"Animasyon, 3 Boyutlu",Juan Jose Campanella,7/17/2015,"34,566","390,774","Juan José Campanella,  Mercedes Gamero",Peter Serafinowicz,6.4,4,"Arjantin, İspanya"
Alkarısı: Cinnet,,"Korku, Gerilim",Muzaffer Gülçek,6/26/2015,"34,451","354,702",Calion Film,"Sanem İşler, Tuncay Tarhan, Mehmet Tokatlı",2.2,7,Türkiye
Sihirli Orman,Into the Woods,"Komedi, Fantastik, Müzikal",Rob Marshall,2/20/2015,"33,638","423,087",Disney,"Meryl Streep, Johnny Depp, Chris Pine",5.9,4,ABD
Boyun Eğmez,Unbroken,"Dram, Savaş",Angelina Jolie,2/20/2015,"32,173","400,351",Universal,"Jack O'Connell, Domhnall Gleeson, Garrett Hedlund",7.2,4,ABD
Kanlı Tatil,Indigenous,Korku,Alastair Orr,7/17/2015,"31,383","318,593","Mark C. Manuel ,  Ted O'Neal ","Zachary Soetenga, Lindsey McKeon, Sofia Pernas",4.5,10,ABD
Unutma Beni,Still Alice,Dram,"Richard Glatzer, Wash Westmoreland",2/13/2015,"32,053","415,454",James Brown (III),"Julianne Moore, Alec Baldwin, Kate Bosworth",7.5,13,ABD
Poltergeist: Kötü Ruh,Poltergeist,Korku,Gil Kenan,5/22/2015,"30,982","333,804",20th Century Studios,"Sam Rockwell, Rosemarie DeWitt, Jared Harris",4.9,5,ABD
Şeytani Ruhlar,Demonic,Korku,Will Canon,5/8/2015,"30,631","334,960",Lee Clay,"Maria Bello, Frank Grillo, Cody Horn",5.3,5,"ABD, Birleşik Krallık"
Steve Jobs,,Biyografi,Danny Boyle,12/11/2015,"29,758","444,435",Universal,"Kate Winslet, Seth Rogen, Jeff Daniels",7.2,3,ABD
Çalsın Sazlar,,"Komedi, Aşk, Dram",Nesli Çölgeçen,1/9/2015,"28,408","304,827",Plan Prodüksiyon,"Belçim Bilgin, Engin Hepileri, Murat Ercanlı",5.8,8,Türkiye
Kü'fa: Cin Kapanı,,"Korku, Gerilim",Aykut Karagöl,10/16/2015,"28,176","282,835",Ervizyon,"Zerrin Eren, Ezgi Yanık, Onur Elaldı",2.0,9,Türkiye
Düşlerin Terzisi,The Dressmaker,Dram,Jocelyn Moorhouse,11/6/2015,"27,089","438,921",Sue Maslin,"Kate Winslet, Liam Hemsworth, Hugo Weaving",7.0,10,Avustralya
Krallar Kulübü,,Komedi,Tuncay Erol,7/17/2015,"25,914","254,729",Minerva Film,"Nuri Alço, Ozan Akbaba, Özge Dolay",4.8,7,Türkiye
Tatil Zamanı,Vacation,"Macera, Komedi","John Francis Daley, Jonathan M. Goldstein",8/14/2015,"25,434","318,929",Warner Bros.,"John Francis Daley, Skyler Gisondo, Steele Stebbins",6.1,3,ABD
Afacanlar Takımı: Büyük Yarış,Raven: The Little Rascal,Animasyon,Ute von Münchow-Pohl,10/30/2015,"34,316","272,982",Dirk Beinhold,Oya Küçümen,5.9,28,ALMANYA
Karanlık Yerler,Dark Places,"Gerilim, Dram",Gilles Paquet-Brenner,6/26/2015,"24,631","279,276",Prince Azim,"Charlize Theron, Chloe Grace Moretz, Nicholas Hoult",6.2,7,ABD
Daire,The Loft,Gerilim,Erik Van Looy,4/10/2015,"23,854","317,918",Hilde De Laere,"Rhona Mitra, Karl Urban, James Marsden",6.3,4,ABD
Mantıksız Adam,Irrational Man,Komedi,Woody Allen,10/9/2015,"22,720","346,662",Letty Aronson,"Joaquin Phoenix, Parker Posey, Emma Stone",6.6,10,ABD
Rüzgarın Hatıraları,,"Dram, Tarihi",Özcan Alper,12/11/2015,"26,077","309,554","Most Production, Nar Film","Tuba Büyüküstün, Mustafa Uğurlu, Onur Saylak",6.3,16,Türkiye
Şans Ayağıma Geldi,The Cobbler,"Komedi, Dram","Thomas McCarthy, Tom McCarthy",4/3/2015,"21,675","281,998",Mary Jane Skalski,"Adam Sandler, Dustin Hoffman, Steve Buscemi",5.8,12,ABD
Pinokyo,Pinocchio,Animasyon,Anna Justice,4/23/2015,"21,627","230,380",Andrew Miano,"Alp Kırşan, Cemre Kemer",5.2,3,ALMANYA
Korku Terapisi,Regression,Gerilim,Alejandro Amenabar,10/9/2015,"21,088","294,798",Alejandro Amenábar,"Ethan Hawke, Emma Watson, David Thewlis",5.6,8,"ABD, İspanya"
Geçmişten Gelen,The Gift,Gerilim,Joel Edgerton,8/14/2015,"21,047","282,470",Jason Blum,"Jason Bateman, Rebecca Hall, Joel Edgerton",7.0,4,"ABD, Avustralya"
Katran,The Tragedy,Korku,Ersen Denk,2/13/2015,"21,033","204,210",Ersen Denk,"Wilma Elles, Lucia Oskerova, Cihan Toraman",3.7,6,ABD
Peşimdeki Şeytan,It Follows,Korku,David Robert Mitchell,5/8/2015,"21,017","216,398",David Kaplan,"Maika Monroe, Keir Gilchrist, Olivia Luccardi",6.8,15,ABD
İntikam Kapanı,Everly,Aksiyon,Joe Lynch,4/24/2015,"20,175","233,958",Rob Paris,"Salma Hayek, Hiroyuki Watanabe, Gabriella Wright",5.1,3,ABD
Büyük Oyun,Big Game,"Macera, Aksiyon",Jalmari Helander,7/3/2015,"19,832","211,900",Will Clarke,"Samuel L. Jackson, Jim Broadbent, Mehmet Kurtuluş",5.4,6,"Almanya, Birleşik Krallık, Finlandiya"
Gece Takibi,Run All Night,"Suç, Aksiyon",Jaume Collet-Serra,5/22/2015,"19,598","241,381",Warner Bros.,"Liam Neeson, Ed Harris, Joel Kinnaman",6.6,4,ABD
Bulantı,,Dram,Zeki Demirkubuz,10/2/2015,"21,056","228,428",Mavi Film,"Zeki Demirkubuz, Çağlar Çorumlu, Şebnem Hassanisoughi",4.8,18,Türkiye
American Ultra,,"Komedi, Aksiyon",Nima Nourizadeh,8/28/2015,"19,451","220,378",Anthony Bregman,"Kristen Stewart, Jesse Eisenberg, Bill Pullman",6.1,3,AB
Danny Collins,,"Komedi, Dram",Dan Fogelman,3/27/2015,"19,215","301,248",Jessie Nelson,"Nick Offerman, Scott Lawrence, Melissa Benoist",7.0,6,ABD
Darbe,,Macera,Yasin Uslu,7/31/2015,"19,212","192,767",TFT Yapım,"Cansel Elçin, Erdinç Gülener, Öykü Çelik",3.2,5,Türkiye
Yav He He,,Komedi,Volkan Özgümüş,2/13/2015,"19,417","190,282",Yav He He Film,"Yücel Gökçek, Sabahattin Yakup, Ayşenil Şamlıoğlu",4.3,12,Türkiye
Şeytanın Gecesi,"Backmask, Exeter","Korku, Gerilim",Marcus Nispel,9/4/2015,"19,165","191,177",Brandt Andersen,"Stephen Lang, Brittany Curran, Gage Golightly",4.5,9,ABD
Sicario,,"Dram, Suç",Denis Villeneuve,9/18/2015,"19,088","290,953",Basil Iwanyk,"Benicio Del Toro, Emily Blunt, Josh Brolin",7.6,4,ABD
İlişki Durumu: Kaçamak,She's Funny That Way,Komedi,Peter Bogdanovich,9/11/2015,"18,983","261,276","Logan Levy , George Drakoulias","Michael Shannon, Imogen Poots, Owen Wilson",6.1,3,ABD
Vahşet Geçidi,Lemon Tree Passage,"Korku, Gerilim",David Campbell,8/7/2015,"18,962","194,695",Jeremy Ervine,"Jessica Tovey, Nicholas Gunn, Pippa Black",3.9,8,Avustralya
Goosebumps: Canavarlar Firarda,Goosebumps,"Macera, Komedi, 3 Boyutlu",Rob Letterman,11/27/2015,"18,828","266,829",Sony Pictures,"Jack Black, Halston Sage, Odeya Rush",6.3,3,ABD
Mustang,,Dram,Deniz Gamze Ergüven,10/23/2015,"25,419","279,016",Bam Film,"Günes Sensoy, Doga Zeynep Doguslu, Elit İşcan",7.6,22,"Türkiye, Almanya, Fransa"
Evlenmeden Olmaz,,Romantik-Komedi,Yasemin Erkul Türkmenli,10/23/2015,"18,466","182,743",Yakaza Film,"Özge Özberk, Cansel Elçin, Hakan Eratik",3.7,8,Türkiye
Gece Bitmeden,Before We Go,"Komedi, Aşk, Dram",Chris Evans,9/11/2015,"18,218","212,115",Howard Baldwin,"Chris Evans, Alice Eve, Emma Fitzpatrick",6.8,4,ABD
Takım: Mahalle Aşkına!,,Macera,Emre Şahin,10/23/2015,"18,158","206,469","Karga Seven Pictures, Spark Fim Collective","Sinan Bengier, Uğur Uzunel, Kaan Turgut",5.8,3,Türkiye
Mr. Holmes ve Müthiş Sırrı,Mr. Holmes,"Dram, Suç",Bill Condon,9/11/2015,"17,822","275,919",Iain Canning,"Laura Linney, Ian McKellen, Milo Parker",6.8,7,"ABD, Birleşik Krallık"
Amy,,"Belgesel, Biyografi",Asif Kapadia,10/16/2015,"19,702","302,604",James Gay-Rees,"Amy Winehouse, Mark Ronson, Yasiin Bey",7.8,14,"ABD, Birleşik Krallık"
Abluka,,Dram,Emin Alper,11/6/2015,"24,736","239,825",Liman Film,"Tülin Özen, Ozan Akbaba, Mehmet Özgür",7.2,27,Türkiye
Münafık,,"Korku, Gerilim, Dram",Özkan Aksular,4/3/2015,"17,103","177,288",Mantis Film,"Levent Sülün, Zeynep Okan, Balım Gaye Bayrak",4.8,3,Türkiye
Siyahlı Kadın 2: Ölüm Meleği,The Woman in Black 2: Angel of Death,"Korku, Gerilim",Tom Harper,5/15/2015,"16,846","184,019",Simon Oakes,"Helen McCrory, Jeremy Irvine, Phoebe Fox",4.8,3,Birleşik Krallık
Sonsuz Bir Aşk,,"Komedi, Dram",Ozan Uzunoğlu,4/10/2015,"16,777","169,290",Dama Medya,"İsmail Hacıoğlu, Ferhat Gündoğdu, Özlem Tekin",6.1,6,Türkiye
The Gunman,,"Suç, Aksiyon",Pierre Morel,3/20/2015,"16,333","236,415",Andrew Rona,"Javier Bardem, Sean Penn, Idris Elba",5.8,3,"Birleşik Krallık, İspanya"
Babalar ve Kızları,Fathers and Daughters,Dram,Gabriele Muccino,10/23/2015,"16,084","217,290",Craig J. Flores,"Russell Crowe, Diane Kruger, Jane Fonda",7.0,6,ABD
Çekmeceler,,Dram,"M. Caner Alper, Mehmet Binay",3/6/2015,"15,878","191,909",CAM Film,"Taner Birsel, Ece Dizdar, Tilbe Saran",7.0,3,Türkiye
Mavi Gece,,"Komedi, Fantastik",Ahmet Hoşsöyler,10/30/2015,"15,273","160,353",Tele Yapım,"Fırat Tanış, Ayça Varlıer, Gökhan Mumcu",4.2,2,Türkiye
Sarmaşık,,Dram,Tolga Karaçelik,12/4/2015,"26,381","267,259","Insignia, Kala Film","Özgür Emre Yıldırım, Nadir Sarıbacak, Kadir Çermik",8.0,26,Türkiye
Ejder Yuvası,Dragon Nest: Rise of the Black Dragon,"Animasyon, 3 Boyutlu",Yuefeng Song,4/17/2015,"15,233","156,273",Michael Yijun Wang,"Didem Atlıhan , Pelin Gülmez , Fatih Özkul",6.3,17,Çin
Büyük Tuzak,Colt 45,Aksiyon,Fabrice Du Welz,7/3/2015,"14,708","152,313",Fabrice Du Welz,"Gerard Lanvin, Joey Starr, Alice Taglioni",5.8,5,"Belçika, Fransa"
Piyasadan Büyük Alacağımız Var,,Komedi,Ekin Akçay,9/4/2015,"14,508","141,631",Sami Dündar Film,"Cem Özer, Salih Kalyon, İzzet Başlak",3.6,5,Türkiye
Öyle Ya Da Böyle,,Komedi,Alper Kaya,10/16/2015,"13,671","138,339",Altın Yapım,"Serhat Osman Karagöz, Ferit Kaya, Şeyma Korkmaz",5.1,8,Türkiye
Kara Deniz,Black Sea,Gerilim,Kevin Macdonald,4/24/2015,"13,647","176,211",Kevin Macdonald,"Jude Law, Scoot McNairy, Ben Mendelsohn",6.4,4,"ABD, Birleşik Krallık, Rusya"
Foxcatcher Takımı,Foxcatcher,Dram,Bennett Miller,1/30/2015,"13,619","208,019",Megan Ellison,"Sienna Miller, Steve Carell, Mark Ruffalo",7.0,4,ABD
Eksik,,"Dram, Tarihi",Barış Atay,4/17/2015,"13,538","128,776",Barikat Film,"Uğur Polat, Barış Atay, Özgür Emre Yıldırım",5.8,6,Türkiye
Altınlı Kadın,Woman in Gold,Dram,Simon Curtis,4/10/2015,"13,520","215,614",David M. Thompson,"Tom Schilling, Jonathan Pryce, Ben Miles",7.3,8,"ABD, Birleşik Krallık"
Gassal,,"Korku, Gerilim",Alper Kıvılcım,12/18/2015,"13,449","137,981",İnfo Medya,"Ayhan Eroğlu, Nilay Olcay, Hatice Yıldız",3.2,6,Türkiye
44. Çocuk,Child 44,"Gerilim, Dram",Daniel Espinosa,5/8/2015,"13,024","161,658",Ridley Scott,"Paddy Considine, Tara Fitzgerald, Tom Hardy",6.4,3,ABD
Dünyanın Sonu,Afflicted,"Korku, Macera","Derek Lee, Clif Prowse",8/14/2015,"12,929","152,744",Chris Ferguson,"Derek Lee, Clif Prowse, Michael Gill",6.2,3,"ABD, Kanada"
Ben Kimim?,"Kein System ist sicher, Who am I?",Gerilim,Baran bo Odar,9/4/2015,"14,093","179,091",Quirin Berg,"Tom Schilling, Elyas M'Barek, Hannah Herzsprung",7.5,16,Almanya
Sıradışı Anne,Ricki and the Flash,Dram,Jonathan Demme,9/11/2015,"12,807","197,792",Sony Pictures,"Meryl Streep, Kevin Kline, Rick Springfield",6.0,3,ABD
Tut Sözünü,,"Komedi, Fantastik",Oğuz Çelik,1/2/2015,"12,208","117,583",Turbude Film,"Erkan Can, Burak Serdar Şanal, Ayla Algan",5.4,3,Türkiye
Hayallerimdeki Kadın,Manglehorn,Dram,David Gordon Green,8/21/2015,"12,122","176,867",Molly Conners,"Holly Hunter, Al Pacino, Harmony Korine",5.5,4,ABD
Tehlikeyle Flört,,Komedi,Murat Şenöy,5/1/2015,"11,912","130,402",Limon Film,"Tuğrul Tülek, Ozan Kotra, Çağatay Kehribar",6.0,6,Türkiye
Kuzu,,Dram,Kutluğ Ataman,6/19/2015,"11,838","116,619",Saatleri Ayarlama Ens.,"Taner Birsel, Güven Kıraç, Nesrin Cavadzade",6.5,6,Türkiye
Darağacı,The Gallows,"Korku, Gerilim","Travis Cluff, Chris Lofing",7/24/2015,"11,591","121,093",Warner Bros.,"Reese Mishler, Pfeifer Brown, Ryan Shoos",4.2,3,ABD
Magic Mike XXL,,Komedi,Gregory Jacobs,7/17/2015,"11,562","159,775",Warner Bros.,"Channing Tatum, Joe Manganiello, Matt Bomer",5.6,5,ABD
Citizenfour,,Belgesel,Laura Poitras,4/24/2015,"11,907","143,478",Mathilde Bonnefoy,"Edward Snowden, Glenn Greenwald, William Binney",8.0,14,"ABD, Almanya, Birleşik Krallık"
